id	left	target	right	lemma
irritation/n/wlp_gb_b03/16222809	or a lotion that contains benzoyl peroxide can improve you hold your accept free from bacteria . Having said that , facial products which include this drink can also trigger	irritation	, redness and @ @ @ @ @ @ @ @ @ @ toiletries that possess triclosan and chlorhexidine . Pimples treatments which consist of sulfur can also offer the	irritation
discomfort/n/wlp_gb_b04/2376796	, skills and talents to the deck . Combined , they work hard to create unique and flawless options for ##3020643 <h> What You Need To Do About Your Back	Discomfort	<p> There are millions of back pain sufferers from countries all over the world . Back discomfort can make it incredibly difficult to perform everyday tasks , and it is	discomfort
irritation/n/wlp_gb_b04/5945673	for the first time , decades of child-abuse and failures by the public authorities are being investigated ; the local politicians have made no effort to disguise their anger and	irritation	at the " bad publicity " and the questions raised about their competence and stewardship of public safety ; suddenly -- a couple of weeks before a Jersey general election	irritation
discomfort/n/wlp_gb_b02/14194658	best results you can get . <p> 1 . ProExtender ? ***** *********** Device One of the leading penile traction devices , and one that does not lead to any	discomfort	. Use of the device leads to a balanced growth of the tissues of the ***** . This is a natural process that actually results in fresh tissues resulting in	discomfort
discomfort/n/wlp_gb_b01/17322087	required to go for this kind of examination . <p> Doctors definitely will talk to a person whether you have got fevers , chills , nausea , vomiting , flank	discomfort	or maybe other sorts of warning signs that will @ @ @ @ @ @ @ @ @ @ results in hippuric acid in your urine which often acidifies your	discomfort
discomfort/n/wlp_gb_b05/500052	. I will do the same thing , I promise I 'll back as soon as possible . I will give ##3004468 <h> ugg bailey button triplet well as the	discomfort	<p> ugg boots clearance stated some inside the delegations experienced discussed a " temporal outlook " for how extended his federal government may last . The time using the federal	discomfort
discomfort/n/wlp_gb_b03/2495634	small and intimate and relatively quick to make , are an obvious counter to that . I suspect , from looking at them , that he himself felt a certain	discomfort	at what Penn had made . I asked him , and he sort of huffed and said Penn was n't him and he was n't Penn and each to his	discomfort
discomfort/n/wlp_gb_b03/1048054	and Cruelty to Animals Act ' , published in 1952 by the Research Defence Society to update MPs on animal rights legislation . The pamphlet clearly articulates the scientists '	discomfort	and dissatisfaction with the attention and criticism they were receiving , and it is interesting to read about researchers ' perspectives at @ @ @ @ @ @ @ @	discomfort
discomfort/n/wlp_gb_b05/10173019	our tea table against the door just for this very reason , as a precaution ; rather a primary school attitude but you can just imagine the intensity of his	discomfort	. His immediate reaction was to hit the off button on the DVD player and on came a regular sky channel . <p> Dad walked in rather confused wondering why	discomfort
discomfort/n/wlp_gb_b03/7007455	a doddle , for others , it 's a nightmare ! <p> Earplanes by Cirrus Healthcare protect your ears when travelling . <p> And , if the source of their	discomfort	is n't the thought of plummeting to earth in a ball of flames , then it 's almost certainly the annoying sound effects you habitually get when you 're flying	discomfort
discomfort/n/wlp_gb_b03/9431195	is just how early on the terror starts . Even if you are n't shaking at the low-tones throbbing over the helicopter shots in the introduction , or sensing the	discomfort	in Wendy 's ( Shelley Duvall ) meeting with the doctor ( Anne Jackson ) , there is not long to wait until Jack ( Jack Nicholson ) is glimpsed	discomfort
discomfort/n/wlp_gb_b07/9064521	us in the British Dental Profession . Whatever treatment you need to have , the discomfort is limited drastically by drugs available and the skills of your dentist . Whatever	discomfort	you might feel pales into insignificance however , compared with the alternative -- the prospect of suffering the most debilitating pain imaginable on a day to day basis , because	discomfort
discomfort/n/wlp_gb_b02/19407636	to quit its hard . The trick is to want to . When you really want to quit - instead of trying to make yourself quit out of fear or	discomfort	@ @ @ @ @ @ @ @ @ @ That new flow fills the void that the bad habit was being used to fill . You need a positive	discomfort
discomfort/n/wlp_gb_b01/5896511	but correct now you require to get down to some brass tacks rein in your young monetary life . <p> Two or A lot more Loans Can Be Rather a	Discomfort	! <p> You could be struggling to come up with the payments on two or A lot more individual student loans . This is putting your credit rating at danger	discomfort
discomfort/n/wlp_gb_b05/4260132	. <p> TIP ! Sleeping pills can help get you through a long flight . The sleeping pill can help you sleep comfortably on a plane by decreasing the surrounding	discomforts	. <p> Know ahead of leaving for a cruise if you are prone to getting seasick . This could ruin your entire trip and make you very dreadful . Seasickness	discomfort
discomfort/n/wlp_gb_b06/465678	fermented in his open chestnut vats , its deep purple juice glistening as it seeped through the cap/ cappello ? <p> Not that the harvest would have actually caused much	discomfort	; anzi /in fact , the last bunches of Luigi ? ? s Aglianico ( for Taurasi ) come from his 80-year-old , raggiera ( avellinese ) trellised , tree-like	discomfort
discomfort/n/wlp_gb_b03/4847942	Do n't allow the fear of experiencing an attack raise your anxiety level . You must understand that no harm will come to you , even though you may experience	discomfort	during the attack . You should remind yourself of this fact especially during times when you are feeling calm and relaxed . This will focus your mind on rational thoughts	discomfort
irritation/n/wlp_gb_b05/20483390	the nervous system , any dysfunction in the digestive system creates a dysfunction in the abdominal muscles . There are two main ways that this occurs . <p> No 1	Irritation	and inflammation <p> The modern diet is very unfriendly to the digestive system , with many of the foods we eat today being so far removed from natural whole foods	irritation
discomfort/n/wlp_gb_b07/6851506	at home . This @ @ @ @ @ @ @ @ @ @ taking pills , then by reducing the number taken each time . A certain amount of	discomfort	and pain in the lower back can be expected until the inflammation and nerve sensitivity have subsided . Heat , exercise , massage , and short rest periods will also	discomfort
discomfort/n/wlp_gb_b07/6507929	secondly is the training to reach the correct fitness to tackle what will be the hell from hell in the jungle and then finally , the actual trek itself where	discomfort	will be the word de jour . <p> We think these people are remarkable . " It is the responsibility of human kind to be the guardians of our animal	discomfort
irritation/n/wlp_gb_b05/14704266	end of the shingle beach . <p> Hearing the grave tone -- seeing the sadness in his grandfather 's face -- Robbie closed his eyes and pursed his lips in	irritation	at his own @ @ @ @ @ @ @ @ @ @ . Tried to frame an apology . <p> His voice trailed off as he failed to find	irritation
discomfort/n/wlp_gb_b07/5839483	know the different ways to treat and cope with it . The tips listed here will help you treat and prevent back pain . <p> Are you struggling with the	discomforts	and limitations of pain in the lower region of your back ? Hypnotic ##3046198 <p> Among the most prevalent illnesses across the globe is diabetes . Each day , increasing	discomfort
discomfort/n/wlp_gb_b05/19732357	. Frank 's a much older character , much more established in the criminal world . It 's a book about the footsteps Calum 's following , and his increasing	discomfort	with where they 're going . <p> Watch for our review of The Necessary Death of ##3710262 <h> Trust Your Eyes <p> Written by Linwood Barclay -- After writing four	discomfort
irritation/n/wlp_gb_b03/14003850	the pictures at the same time . Our excuse is that their internet connection has slowed down but you wo n't be able to use that one . <p> Further	irritation	may be aroused by the incessant intrusion of advert breaks butting up @ @ @ @ @ @ @ @ @ @ a bowling change . In these matters always	irritation
discomfort/n/wlp_gb_b02/5861718	no permanent damage . . . They did not know what would happen . This is what they were trying to find out . . . really they emphasized the	discomfort	. . . this was not going to be an easy task down the road <p> I think it is @ @ @ @ @ @ @ @ @ @	discomfort
discomfort/n/wlp_gb_g11/23130205	of a relationship . In olden times , would you sit outside their house watching their life unfold ? Er , no . <p> \" I hoped that my obvious	discomfort	would put him off as I did n't want to sound immature by saying something " -- She @ @ @ @ @ @ @ @ @ @ then making	discomfort
irritation/n/wlp_gb_g10/17498108	may perhaps aid us in understanding how some reflex actions originated . A radiation of nerve-force of this kind , if it caused a movement tending to lessen the primary	irritation	, as in the case of the contraction of the iris preventing too much light from falling on the retina , might afterwards have been taken advantage of and modified	irritation
irritation/n/wlp_gb_g08/22189410	comatose to the hotel thus saving you from a monumental mistake with a ladyboy in deepest , darkest Bangkok ... the divergent day-to-day circumstances of travel can expose and magnify	irritations	and disparities you never knew existed . And that 's if you 're compatible . Even happens to married couples . <p> If you 're not compatible , sooner or	irritation
discomfort/n/wlp_gb_g11/23080815	the observing conditions . But the credit belongs entirely to the eye . \" <h> Be Comfortable <p> Naturally , this sort of concentration will be spoiled by any undue	discomfort	or inconvenience at the telescope . You 'll need a table right at hand to hold charts , red flashlight , eyepieces , notebook , pencil , and other gear	discomfort
discomfort/n/wlp_gb_g03/2551610	Islam almost 7 years ago and Alhamdulillah things are better now with my Mom in regards to my faith . Everybody else in my family did n't show too much	discomfort	( mostly once I started wearing the hijab ) , but my Mom was extremely disturbed . <p> It was very hard for the first few years , but now	discomfort
discomfort/n/wlp_gb_g07/4910289	who has Endometriosis its a condition that not many people know about . This when the lining of the womb grows in other places . It causes serious pain and	discomfort	in her abdomen . Because she is young not many people believe her or listen to her . I have kinda become a helper to her as a lot of	discomfort
irritation/n/wlp_gb_g09/3371697	Police as it is fraud ) <p> I do n't know which I despise more -- the Express or the Mail . Their shouting headlines are a source of daily	irritation	in the shop . Richard Desmond is a shit of the @ @ @ @ @ @ @ @ @ @ Having grown up reading the Mail I can testify	irritation
irritation/n/wlp_gb_g04/6616306	Keith Richards is perhaps most famous for having constructed a short and very simple rhythmic musical phrase , over the top of which his colleague Mick Jagger expressed an increasing	irritation	at being unable to acquire , in both general and specific terms , any kind of ' satisfaction ' -- despite , as he proceeded to explain , repeatedly attempting	irritation
discomfort/n/wlp_gb_g04/21812731	out the sort of fiscal stimulus which the US and UK adopted in 2009 . For now there is nowhere for pro-European Keynesians to turn . This explains Ed Milibands	discomfort	on the question of what he would have done . In truth he would have agreed @ @ @ @ @ @ @ @ @ @ as the UK was	discomfort
irritation/n/wlp_gb_g10/3941779	Dozens of interviews in Delhi , Amritsar and Ahmedabad revealed admiration for the Raj and its opposite , respect for British \" culture \" and anger at perceived racism ,	irritation	at ignorant pronouncements about Indian " spirituality " and pleasure at the interest young Britons take in the country . @ @ @ @ @ @ @ @ @ @	irritation
discomfort/n/wlp_gb_g12/21075043	him apologise to me . And I meant it . The thing is , \" he concludes , \" I quite like people , in between laughing , to feel	discomfort	. I 'm not sure why . Rob is less comfortable with discomfort . I think he walks away from conflict , whereas I gravitate towards it . " <p>	discomfort
discomfort/n/wlp_gb_g02/2886790	can stay/come in . I do not see how this will benefit the UK economy . Furthermore , this interim period affects my productivity and output with the confusion and	discomfort	it creates . <p> and Bhavna , you are heavily disinforming the readers here with or without purpose . I think you have to be more careful before presenting such	discomfort
discomfort/n/wlp_gb_g07/18988233	to reduce STI transmission . <p> Genitourinary symptoms are an important stimulus to seek health care related to concern for sexually transmitted infections ( STI ) or by causing physical	discomfort	. Even before seeking care , symptomatic individuals may modify their sexual behaviours based on previous experiences , prevalent cultural beliefs , and perceptions of normal versus abnormal health status	discomfort
irritation/n/wlp_gb_g10/329783	seconds was quite stimulating ! Even sitting outside in a bar , beer in hand , watching a train go by five feet away was n't in the least an	irritation	. The beach was the focal point of the town during the day , packed with holidaying Italians , the water was warm , the beach cafe was more than	irritation
discomfort/n/wlp_gb_g09/13146251	even though he was on a similar style food before ( skinners If I remember right ) . <p> I wish your friend luck as it 's frustrating watching their	discomfort	and not being able to solve it . I 'm not really sure whether we have yet , but we 'll see how the next few months go <p> Pictures	discomfort
irritation/n/wlp_gb_g03/12708589	' Some donors have told The Times that they are pessimistic about the next election . Other donors complain about government disarray , lack of action on the economy ,	irritation	at gay marriage plans and the party 's stance on bonuses and bankers . Boris Johnson is attracting some interest from the donor community , according to two of them	irritation
discomfort/n/wlp_gb_g02/2388386	Pot . Boris , espied said feline , and assumed , in his dim , but lovely Labrador brain , that Stalin was the cause of his pain and considerable	discomfort	and took off like a bull after a herd of in heat heifers after his supposed tormentor baying for blood ! <p> Stalin , as would be expected , did	discomfort
irritation/n/wlp_gb_g03/7780444	three or four years to get back to normality , \" he says . <p> As for the UK economy , he recalls his own experience as Chancellor and his	irritation	at colleagues who used to " launch off " onto his patch . <p> So , he insists , he wo n't talk about economic matters . George Osborne ,	irritation
discomfort/n/wlp_gb_g03/4280790	menopause . <p> If you suffer only mild pain before or during your period and infertility is not a factor , over-the-counter pain relief may be enough to alleviate any	discomfort	. <p> A non-surgical option for managing the symptoms of endometriosis is to control hormone stimulation with contraceptive pills , progesterone pills or other drugs . These treatments block ovulation	discomfort
discomfort/n/wlp_gb_g05/15460099	. Some people have many around their genitals and anus . <h> What are the symptoms of anogenital warts ? <p> In most cases , the warts cause no physical	discomfort	. They sometimes cause irritation and soreness , especially if they occur around the anus . Sometimes anogenital warts can bleed or cause pain on intercourse . If you have	discomfort
discomfort/n/wlp_gb_g04/19666608	see the police pursue justice to the fullest of their ability , my fellow feminists -- both female and male , despite being largely supportive , will publicly voice their	discomfort	at the lengths being taken to achieve justice . Will @ @ @ @ @ @ @ @ @ @ rape , but about my rapist 's politics . Robbing	discomfort
discomfort/n/wlp_gb_g01/22018440	the parallels may be , that discomfort is as nothing to going through the process ; and the discomfort of going through the process is as nothing compared to the	discomfort	of not going through it ... <h> Share this : <h> Like this : <h> One thought on " We have to learn to deal with the past " <p>	discomfort
irritation/n/wlp_gb_g05/15729830	reduce the @ @ @ @ @ @ @ @ @ @ . <p> Although US authorities publicly said they sympathised with Mr Karzai 's views , there was private	irritation	that his pronouncements come at what is considered to be critical time in the campaign , when Western forces are attempting to wrest back ground from the Taliban . <p>	irritation
discomfort/n/wlp_gb_g12/3788292	Nicklinson , via a computer , said : \" I believe the legal team are prepared to go all the way , but it means yet another period of physical	discomfort	and mental anguish for me . " <p> Another locked-in syndrome sufferer , who can only be named as Martin , had sought permission for volunteers to help him get	discomfort
irritation/n/wlp_gb_g09/19682584	, half an inch , until it lipped over the fringed edge , telling her that he could come over to her , that he would come over . <p>	Irritation	shocked her awake and she took charge , " I know what @ @ @ @ @ @ @ @ @ @ , waving a hand towards the stairs ,	irritation
irritation/n/wlp_hk_b01/3008433	by a certain allergen , the human body usually identifies this like a risk as well as launches specific chemicals to fight against this particular component triggering different symptoms like	irritation	and others . Keep in mind within severe cases this irritation could cause fatality.br / br / It is important to state that food allergy is a reaction of the	irritation
discomfort/n/wlp_hk_b01/6184055	accord you abounding rewards . Not alone will you be comfy , but you will be in a position to angle and sit for continued hours right after encountering any	discomfort	. You may aswell abstain accepting varicose veins and @ @ @ @ @ @ @ @ @ @ age . <p> In case you want to acquisition out the	discomfort
discomfort/n/wlp_hk_b01/1448138	support it needs when sitting in a chair at the office . If the chair does n't properly support the lumbar region , it can cause a lot of back	discomfort	. Try sitting with a pillow behind this region for better support . <p> TIP ! Do n't ever ignore any back pain . Some people do n't listen to	discomfort
discomfort/n/wlp_hk_b01/7890695	too sends messages to the body <p> Avoid alcohol the day before your flight since it can cause dehydration , which disrupts sleeping schedules , triggers nausea and creates general	discomfort	. <p> Similarly , avoid caffeine before , during or just after the flight as caffeine also causes dehydration and disrupts sleeping schedules . <p> Drink water , especially during	discomfort
discomfort/n/wlp_hk_b01/3121815	like helping a charitable organization , can point out to you that you are not the only one with your situation . Doing this will assistance to distract you from	discomfort	and in addition prevent you from sensing sorry for your self . Several non profit organizations will assist you @ @ @ @ @ @ @ @ @ @ anybody	discomfort
irritation/n/wlp_hk_b01/10761957	skin creams are now more sophisticated than ever . Back in the day , there were creams that had powerful ingredients , but had many downsides . For instance ,	irritation	of the skin was not uncommon upon using those old creams . Also , powerful ingredients became useless since there was a lack of other agents that could help the	irritation
irritation/n/wlp_hk_b01/12632638	@ @ @ @ @ @ was right next to me , leaning casually against my truck . \" How do you do that ? \" I asked in amazed	irritation	. " Do what ? " He held my key out as he spoke . As I reached for it , he dropped it into my palm . " Appear	irritation
irritation/n/wlp_hk_b01/11476487	be wary of mistaking catheter-induced ectopy for the target arrhythmia . Electrograms from catheter-induced complexes meet all criteria for excellent sites of ablation , since they are derived from endocardial	irritation	by the catheter tip ( Fig. 2 ) . Ablation should not be performed at such sites . Pacemapping ( uni- or bipolar ) at putative ablation sites at a	irritation
discomfort/n/wlp_hk_b01/12917081	the floor instead of up on a wall . The cramped space makes it difficult to get a clear view of the photos but it does enhance the feeling of	discomfort	that the haunting images of the ugly babies exude . <p> For those interested in Liu Xia 's photography , please read the essay ' @ @ @ @ @	discomfort
discomfort/n/wlp_hk_b01/3421354	easier to take on big challenges and to endure the hardships they sometimes require . You learn to associate more pleasure to the character development you gain than the minor	discomforts	you experience . You become accustomed to spending more time outside your comfort zone . Hard work is something you look forward to because you know that it will lead	discomfort
irritation/n/wlp_hk_b01/5897087	ainsi que ' s. , 08 ) . Emotional baggage may function psychology hints . Consideration possible developed just as area of a practical structure meant for facilitating family in	irritation	, and thereby kinship can be implicitly connoted by psychological experience with empathy-even should the sympathy is certainly elicited by simply non-kin ( , 1987 ; School yard avec .	irritation
discomfort/n/wlp_hk_b01/9886465	health risks that disproportionately affect men : unipolar depression , sexual dysfunction , risky and animalistic behavior etc . <p> So , in conclusion , whether these \" real-body \"	discomfort	in men is truly new or something that 's only now being noticed is impossible @ @ @ @ @ @ @ @ @ @ images of hairless , sweatless	discomfort
irritation/n/wlp_hk_b01/8781960	water , and for protecting us from harmful ultraviolet radiation by absorbing it in the Stratosphere . But in direct exposure of the respiration system and eyes it is causing	irritations	and also more serious long term health effects . <p> There are also other photochemical substances which are built by similar but more complex processes from primary pollutants . An	irritation
discomfort/n/wlp_hk_b01/1925958	<p> Small , prolapsed piles might be forced back inside of the rear end when you are prepared to get lower and unclean . This may eradicate several of the	discomfort	and pain associated with the hemorrhoids . Even if you can not look at it , look at it just like a skin tag or even a greater mole .	discomfort
irritation/n/wlp_hk_b01/3886424	consider making use of witch hazel towards the place . Witch hazel is actually a organic astringent that will @ @ @ @ @ @ @ @ @ @ the	irritation	. Just implement some for the irritated place and you will quickly feel happy reduction . <p> Facing piles , you must not sit down or remain for days on	irritation
discomfort/n/wlp_hk_b01/5759493	, expenses covered and residence included . <p> Driss joins the small army of other loyal domestic workers that also live in the Philippe household , and makes his initial	discomfort	no secret to everybody . Dealing with a disabled gentleman a generation older than you means that certain values and traditions are bound to clash . But Nakache and Toledano	discomfort
discomfort/n/wlp_hk_b01/5238314	who had arrived in the United States and other countries have begun to improve air safety measures to take , but also increase the inconvenience to passengers and travelers and	discomfort	. Bali Villas with a land airport in prison without if you want to do it , the more you read , and you have to prepare . The loss	discomfort
irritation/n/wlp_hk_b01/6148925	warmer seasons . You can even cool yourself off thanks to lotions . <p> These procedures can leave you hair follicles open and tanning could cause some skin troubles .	Irritation	is a common side effect that happens shortly after waxing or sugaring . This goes for using scented skin products as well . These products interact with open follicles in	irritation
discomfort/n/wlp_hk_b01/466180	do n't need gimmicks to burn your fat but it does nt mean you do n't feel like you are comfortable to eat ; <p> Make sure you feeling of	discomfort	after taking cold water as your body grows resistant to combined with many health problems ; <p> There are permanently wired to carry extra blubber ; <p> Often in cases	discomfort
discomfort/n/wlp_hk_b01/1039899	associated to zits . <p> When you have delicate epidermis , never ever use house pore strips . Fixing an adhesive to slim or fine epidermis could lead to severe	discomfort	and irritation with eradication , and might also rip out locks through the follicle @ @ @ @ @ @ @ @ @ @ to eliminate remnants of the adhesive	discomfort
irritation/n/wlp_hk_b01/95887	to be aware of any area of your baby 's skin that might be exposed , particularly when it is cold . It does n't take long for a skin	irritation	to develop , so it 's best to be vigilant about this . <p> A baby 's skin can be helped quite a lot by some natural oils that have	irritation
