id	left	target	right	lemma
discomfort/n/wlp_hk_b01/4738702	, it is best to bring ( and use ) loose-fitting clothes made of lightweight materials to enjoy going around the country even more , so you can avoid the	discomfort	of having to deal with the humidity and heat with clothes that are too thick/too bulky . <p> The weather should also be taken into consideration when planning on visiting	discomfort
discomfort/n/wlp_hk_b01/9853132	usually spend much time grooming themselves and this leads to the swallowing of fur . If the amount swallowed gets very high , it can cause blocking that brings about	discomfort	. To prevent such a situation , you can use medicines containing laxative properties . These medications will ensure that fur does not ball up in the bowels of your	discomfort
discomfort/n/wlp_hk_b01/9896831	, it is best to do first skin test -- finished products coated on the inside of the wrist , 5-10 minutes after cleaning , if not inflamed or allergy	discomfort	, you can rest assured that use . <p> Apple Mask : Apple contained acid , can make the skin smooth , moist , soft white , but also eliminate	discomfort
irritation/n/wlp_hk_b01/8509137	effect each the atmosphere and the babies . Even if you are wearing the synthetic clothes chances are that baby 's soft skin comes in contact with it and feels	irritation	. <p> The natural clothes are a lot more comfortable . <p> These are extremely absorbent and are quite soft to prevent any harm to the soft skin of the	irritation
irritation/n/wlp_hk_g02/12414563	to prevent mould ) ; in consequence , it enters into contact with consumers , penetrating through clothing onto their skin , causing painful skin contact dermatitis , itching ,	irritation	, redness and burns , as well as , in some cases , breathing difficulties . <p> DMF is already outlawed as an active substance in biocides that are placed	irritation
discomfort/n/wlp_hk_g01/477976	ideas , associations , as well as behaviors . These types of aged methods for becoming begin to area , plus they achieve this , these people provide the actual	discomfort	they 've triggered all of us yet others towards the area too . This can move , in the event that we are able to stay mindful as well as	discomfort
irritation/n/wlp_hk_g01/3346534	funny things . They are like a cranky long lost aunt that you do n't like to see . There 's a familiarity to it , as well as an	irritation	, and a sense of what 's ' right ' : just like you know you should spend time with them because they 're family , you also know you	irritation
discomfort/n/wlp_hk_g02/3936880	risk of digestive-system problems . In actuality , most gut disorders that arise during exercise are caused by dehydration , not from taking in fluid . Dehydration induces nausea and	discomfort	by reducing blood flow to the digestive system , so by all means keep drinking ! So what is actually happening to us ? <p> Exercise produces heat . Prevention	discomfort
irritation/n/wlp_hk_g01/6728400	product proposition of preventing shave irritation , Edge sought out users who were irritated by everyday problems and @ @ @ @ @ @ @ @ @ @ these \"	irritations	\" by sending humorous replies and gifts ( in the form of cereal , iPads , computers to megaphones ) to them . <p> b . Kotex Women 's Inspiration	irritation
discomfort/n/wlp_hk_g02/5477635	Moisturizers , water atomizers and eye drops are usually sufficient to avoid any discomfort . Most passengers who wear contact lenses have no problems inflight , but some do experience	discomfort	and prefer to wear spectacles instead . <h> Cosmic Radiation <p> Cosmic radiation is a naturally occurring form of ionising radiation that arises from the sun and the galaxies outside	discomfort
irritation/n/wlp_hk_g01/4974184	cotton thistle and chamomile essential oil combined with probiotics which work to encourage healthy bacteria on the skin 's surface and reducing those that cause redness , itching and other	irritation	. Alongside the range , the brand has developed a specific spa treatment using cold stones to cool , soothe and regulate sensitive skin . <h> " I am seeing	irritation
discomfort/n/wlp_hk_g01/12284177	state firms ( and perhaps slowing its uptake of Iranian oil ) , but also refusing to back stiffer action against the Iranians at the UN . To cover its	discomfort	, Beijing falls back on rhetoric , arguing about ##1160320 <h> Cartoon hero <p> Animation firm hopes five hamsters will conquer China <p> Walt Disney came up with Mickey Mouse	discomfort
discomfort/n/wlp_hk_g01/11213141	an undue amount of discomfort you should inform your Osteopath immediately so they can modify their technique to your comfort levels . Cranial techniques are less direct and never cause	discomfort	. Top <p> &gt;&gt;Do I have to be manipulated to get pain relief ? <p> No , the same results can be achieved using alternative techniques . While the Osteopath	discomfort
discomfort/n/wlp_hk_g01/11005325	each minute spent in a back-bend , you should spend a minute in a forward-bend . By twisting your back and practising forward-bends , you should avoid any kind of	discomfort	or injury - and gradually be able to go deeper and deeper in your poses . A good and long Pashchimottnsana , Padottnsana or Janushrshsana at the end of your	discomfort
irritation/n/wlp_hk_g01/15155719	enhance the body 's immune function . Early morning drink , drink the same water with the best room temperature , cold weather can drink warm water to minimize gastrointestinal	irritation	. Those who used to drink warm , cold water of the people , the higher the enzyme activity in vivo oxygen , metabolic state is good , the accumulation	irritation
discomfort/n/wlp_hk_g01/10577150	@ @ @ @ @ @ @ @ @ painfully bright environment , we elected to just have the one drink and then leave lest our eyes start watering from	discomfort	. <p> I have to say , prior to this encounter it had not occurred to me to join or post on OpenRice , however , this brief encounter compelled	discomfort
discomfort/n/wlp_hk_g02/4534903	the residual hearing can be avoided ##1136995 <h> When do you need a hearing aid ? <p> A lot of hearing loss is gradually formed and you will not feel	discomfort	or pain in the process . In many cases , other persons in the family often adapt to this change and they do not know the emergence of a hearing	discomfort
discomfort/n/wlp_hk_g01/10133919	per oz . ) . <p> These ingredients @ @ @ @ @ @ @ @ @ @ less concentrated , more difficult to re-hydrate , and may cause intestinal	discomfort	. When rapid replacement of sweat loss is important , athletes should not to take any energy drinks , particularly soon before or during physical activities . <p> Athletes under	discomfort
irritation/n/wlp_hk_g02/10100917	on the contents of the Michelin Green Guide ##1152676 <p> Sound therapy has been used for treating tinnitus for a long time and can effectively mitigate tinnitus and reduce tinnitus	irritation	of patients . Generally , tinnitus masking treatment is carried out in a hospital . This causes the patient much inconvenience and expense for long-term treatment . Above all ,	irritation
discomfort/n/wlp_hk_g01/10758573	after joining the Paida and Lajin workshop , I knew the test result would be better , because I can feel the improvement in my health and also all the	discomforts	, like pain and ache , were gone with the wind . Usually , I would have Hay Fever during the spring season . From February 2011 until now ,	discomfort
irritation/n/wlp_hk_g01/11515864	face with running water . Massage with foaming cleanser lathered up on your palm and wash off with warm water and cool water using the showerhead to remove impurities without	irritation	. Then , warm First Care Serum on your palm and wrap your face with it to restore balance and leave the skin healthy . <p> To soothe the redness	irritation
irritation/n/wlp_hk_g02/11947150	in his book Conceptual Blockbusting ( W.W. Norton , New York and London 1979 ) , to refer to a list of things which cause you , or others ,	irritation	or . dissatisfaction . It 's purpose is to stimulate the search for opportunities . <p> This method can be applied usefully in organisations by soliciting the opinions of staff	irritation
irritation/n/wlp_hk_g01/10819239	or other gastric protective medications , in order to reduce risk of bleeding and gastrointestinal tract discomforts . <p> A newer generation of NSAIDs ( e.g. Celecoxib ) cause few	irritation	@ @ @ @ @ @ @ @ @ @ not required to take antacids with the newer NSAIDs . <p> Simple painkillers ( e.g. Paracetamol ) relieves pain only	irritation
discomfort/n/wlp_hk_g01/158056	. Exterior hemroids tend to be more unpleasant compared to inner and a few period it requires surgical procedure . Within inner hemroid will not provide discomfort place it provide	discomfort	whenever stress upon problematic vein improved . There are lots of regarding hemroids such as cracks , inflammation , burning venapro reviews up within the rectum , problems within moving	discomfort
discomfort/n/wlp_hk_g02/7439180	recommend this manual therapy to anyone as it is non-invasive and highly successful ! J.Hauser <p> Shoulder pain I came to richard with shoulder pain and after one treatment my	discomfort	vanished ! He 's patient , compassionate , knowledgeable and gives 200% to his patients . I would highly recommend Richard to anyone suffering from any physical ailment . "	discomfort
discomfort/n/wlp_hk_g02/4586954	away that accumulated tension in a variety of joints and muscles or just for peace , there are therapeutic massage centers that supply you the final in relaxation . Bodily	discomfort	, stress and pressure are the bane of residing in a very present day modern society . People barely recognize the time from their limited work schedules and loved ones	discomfort
irritation/n/wlp_hk_g01/4819909	technique ; in addition to the obvious infection and pain , the metal jackets ? which weigh in excess of 10 kilos ? also cause massive hair loss and painful	irritation	over the bears ' bodies . <p> This method of extraction was also very dangerous for the farmer , who needed to crawl under the cage for a period of	irritation
discomfort/n/wlp_hk_g01/7867018	penis to see whether there are obstructions or not . A urologist is a specialist that might perform this tests and it only requires local anesthetic to prevent pain and	discomfort	. <p> NOCTURNAL TUMESCENCE TEST <p> If other tests are inconclusive or your doctor thinks your erectile dysfunction might be caused by non-physical issues , you might take the nocturnal	discomfort
discomfort/n/wlp_hk_g01/12708214	. Symptoms include lumbar pain , weakness or numbness of lower limbs , legs get fatigued easily . The patient has to sit down for some time to ease the	discomforts	. However , symptoms will occur again when the patient resumes walking or standing for @ @ @ @ @ @ @ @ @ @ In the early stages of	discomfort
