id	left	target	right	lemma
acknowledgement/n/wlp_ca_b01/21845339	mysterious a process , fundamental principles are involved that do n't require an MBA degree ... but that first , we need to have a full , honest and thorough	acknowledgement	of how what , by rights should be a selling point to Hamiltonians and visitors alike is anything but . And I suspect we 're nowhere near having that conversation	acknowledgement
acknowledgement/n/wlp_ca_b02/6397947	Miss Carry Lazarus , Miss Himes , Miss K. Franklin and Miss P. Teichman ( all 3rd class members -- i.e , under 21 or apprentice/pupil ) . <p> (	Acknowledgement	: With thanks to Anne Joseph , chronicler of the Joseph family , for reviewing this article . ) <p> ( Adapted from an ##3351074 <h> About Jesse <p> Episode	acknowledgement
acknowledgement/n/wlp_ca_b02/19614463	. And she is exactly just what her tag lines says , \" Your #1 Resource for Connecting Women and Their Businesses \" . <p> My topic was : <p>	Acknowledgement	-- Everyone wants to have a great feeling and they want to be delighted and enchanted . What can we learn from the norm @ @ @ @ @ @	acknowledgement
acknowledgement/n/wlp_ca_b02/3161642	I will say simply your writing , always , moves me . Your sharing so openly pulls from the shadows things for so many people , for me . Your	acknowledgement	of yourself as a gift to others , your life as one that has mattered at such a level of depth to so many people able to share their own	acknowledgement
acknowledgment/n/wlp_ca_b01/14687035	yet when Alcoholics Anonymous is represented it is almost always presented a community of integrity ? It is no coincidence that the latter example is largely defined by their explicit	acknowledgment	of their brokenness . We must regain this integrity in the church and that will happen only when we put pretense to death . In its place we must embrace	acknowledgment
acknowledgment/n/wlp_ca_b02/9786856	be a lot . I started with the Acknowledgment sections , a section I had generally skipped or skimmed over . And the strategy worked . I would read the	Acknowledgments	and somehow it would get me motivated to read the book . Here 's an example that I loved from a book called Seeing Like A State : How Certain	acknowledgment
acknowledgment/n/wlp_ca_b01/12871808	and that therefore no position would be taken and the status quo maintained ( this was in 2005 -- it may have changed by today ) . There was no	acknowledgment	that taking " no position " was the same as taking a position against same sex marriage <p> One day in a sermon our Minister , whom I still hold	acknowledgment
acknowledgement/n/wlp_ca_b02/7944664	@ @ @ @ @ @ @ @ @ @ Never assume that a forklift operator has seen you . Unless you make eye contact and get an operator 's	acknowledgement	, stay well away from the lift truck . <p> Stick to designated walkways and crosswalks designed to separate forklifts and pedestrians . <h> Here are some additional tips for	acknowledgement
acknowledgment/n/wlp_ca_g05/16540609	. Mr. Cameron 's Kashmir apology was met with a hail of condemnation in the opinion pages of The Daily Telegraph and the Daily Mail , darkly suggesting that such	acknowledgments	would damage Britain 's standing . <p> @ @ @ @ @ @ @ @ @ @ , by the time children turn 18 , they 've been given three	acknowledgment
acknowledgement/n/wlp_ca_g03/12961196	to someone 's home you one would not say I see that this is your home . <p> From this perspective , it seems that the lip-service paid to '	acknowledgement	statements ' of being on occupied land has taken on a life of its own and/or has become a platitude rather than a conscious , considered , relevant , respectful	acknowledgement
acknowledgement/n/wlp_ca_g03/9250712	. Nothing leads into it , nothing flows from it . It 's almost a throwaway comment in a throwaway article - except for the fact that it 's an	acknowledgement	of something James ca n't quite bring himself to realize , otherwise he 'd need to throw the entire piece in the dumpster . <p> Look at it again :	acknowledgement
acknowledgement/n/wlp_ca_g02/7394376	the silent signal at the time . @ @ @ @ @ @ @ @ @ @ then Phillips would have paused with Cape Race and taken the message for	acknowledgement	. <p> FOOTNOTES : <p> 1 Titanic 's visual call sign was HVMP . This information is taken from the " General Register and Record Office of Shipping and Seamen	acknowledgement
acknowledgement/n/wlp_ca_g01/12741808	of ROEs will extract data from their payroll systems and submit them to HRSDC in batches , using file transfer protocol , for bulk processing . The originator will receive	acknowledgement	of valid transactions and rejections . Security mechanisms using @ @ @ @ @ @ @ @ @ @ and authenticity of data exchanged between employers and HRSDC over the	acknowledgement
acknowledgement/n/wlp_ca_g01/16004343	of public knowledge about this man . His looks like a candidacy that it about a long road to recovery for the Liberal Party -- there 's an almost implicit	acknowledgement	that he probably ca n't be in a position to win the next election . <p> Many in the Liberal Party know that the chances of extinction are real ,	acknowledgement
acknowledgement/n/wlp_ca_g05/19323084	on TV today , they just might be two of the most consistently funny people -- except for Louis C.K. , whom I 'm sure will get multiple shout-outs and	acknowledgements	, or would if the Hollywood Foreign Press @ @ @ @ @ @ @ @ @ @ weirdo . <p> But let 's just confine our joy to the	acknowledgement
acknowledgement/n/wlp_ca_g02/13242874	many coffee sessions and twitter PMs , along with the always-loyal David Bowie and Junot Diaz . ' <p> Right . Having said this , I still find my own	Acknowledgements	important for each book , and I spend some time on them . And , as it happens , I am one of those readers interested in the acknowledgements of	acknowledgement
acknowledgement/n/wlp_ca_g04/6272930	primarily known and explained through a set of scientific tools and methods . <p> To say that there is middle ground is not a negative thing . It is an	acknowledgement	of the fact that , while we will never get it totally right , a multi-facted perspective is the best way to come closer to the teachers we aspire to	acknowledgement
acknowledgement/n/wlp_ca_g03/3866845	that of most other Canadians . It is referred to jokingly by Aboriginal people as \" Indian time \" or \" Metis time . \" But it is simply an	acknowledgement	that events will take place when it is the proper time , after the required social protocols have been followed , or as long as they do not interfere with	acknowledgement
acknowledgement/n/wlp_ca_g01/14207125	. He also did n't do anything substantive to stand tall for the cause . <p> Three games is meaningless . It 's worse than that -- it 's an	acknowledgement	that wrong was done , but a wrong judged so perfunctory that it requires only a sop to the whiners . <p> At least Anthopoulos did not end up playing	acknowledgement
acknowledgement/n/wlp_ca_g01/454859	to want to remove himself completely from People Park . He has burned all his notes and deleted all emails relating to the novel . He does not want an	acknowledgements	page , nor does he plan on dedicating the book to anyone ( " Who would want this ? " he asks ) . When Bland raises the subject of	acknowledgement
acknowledgement/n/wlp_ca_g05/18947538	<p> NOTE : You must bring photo identification and proof of application to the programs for which you are testing ( Georgian number and OCAS number -- available on your	acknowledgement	letter from Georgian @ @ @ @ @ @ @ @ @ @ . <p> NOTE : Parking at the College is $5.00 . ##721397 <h> Looking for a Church	acknowledgement
acknowledgement/n/wlp_ca_g03/15903008	formed Aboriginal veterans ' associations . Their search for compensation extended into the next century . <p> Many Aboriginal veterans stressed that they sought one thing above all else :	acknowledgement	for their contributions . They had participated in the national war efforts from 1914 to 1919 and from 1939 to 1945 . They had fought as equals with their comrades-in-arms	acknowledgement
acknowledgment/n/wlp_ca_g02/15154733	religious ethic of Philo , a combination of Stoic , Platonic , Neopythagorean and Old Testament gnomic wisdom , already bears the marks which we recognise in Neo-platonism . The	acknowledgment	that God was exalted above all thought was a sort of tribute which Greek philosophy @ @ @ @ @ @ @ @ @ @ , in return for the	acknowledgment
acknowledgment/n/wlp_ca_g05/20387309	. During the repeated texts ( 6 hours later ) , I contacted technical assistance and asked for the messages to be \" pushed \" through , with a verbal	acknowledgment	of receipt . This was either done and failed , or it was n't done at all ... as I said , the message repeated for the following 24 hours	acknowledgment
acknowledgement/n/wlp_ca_g04/143317	\" said Mr. Graham . \" We want to create a significant hub of youth resources in the community . \" <p> For more information and ##4675 <h> Preface and	Acknowledgements	<p> There is urgent need to repair the damage done to nursing through a decade of healthcare reform and restructuring . The case for constructive change is compelling . However	acknowledgement
acknowledgement/n/wlp_ca_g01/19682548	. The pamphlet goes on to finally mention Autism . But notice the wording - Who can benefit from Hyperbaric Oxygen ? The answer is not direct but rather an	acknowledgement	that Autism is treated at their center . <p> An example of where mainstream science accepts hyperbaric treatment is then given . <p> Studies have shown that HBOT is effective	acknowledgement
acknowledgement/n/wlp_ca_g04/14160762	of the original field area . Such extrapolations serve only to obscure understanding of an already complex stratigraphy ( see Hayes , 1990 , for further discussion ) . <h>	Acknowledgements	<p> We are indebted to Canadian Hunter Exploration Ltd. for a great deal of technical support and general encouragement . Ruth Nixon , John Harkness and Barb Gies in particular	acknowledgement
acknowledgement/n/wlp_ca_g05/7343285	your email has your name , the email to contact you at , the amount of your donation and what currency it 's in . I 'll send an you	acknowledgement	as I work through the list and you @ @ @ @ @ @ @ @ @ @ this mess is kwb AT yarnharlot DOT ca <p> 2 . If	acknowledgement
acknowledgment/n/wlp_ca_g01/16926092	; <p> ( c ) in the case of service on a partnership , <p> ( i ) personally or by a mail service that provides the sender with an	acknowledgment	of receipt on any one or more of the partners , or an individual having , at the time of service , control or management of the partnership business at	acknowledgment
acknowledgment/n/wlp_ca_g04/6248685	, also means and includes the plural number and vice versa , unless the context otherwise requires . Any @ @ @ @ @ @ @ @ @ @ <p>	Acknowledgments	The Occupational Health and Safety Regulation is the outcome of an open , comprehensive , consultative process that directly involved representatives of the employer and worker communities in the development	acknowledgment
acknowledgment/n/wlp_ca_g05/9947061	Gallery of Peterborough or the copyright owner . The Art Gallery of Peterborough owns and is responsible for all copyright notices covering the images , text and any other accompanying	acknowledgments	. Any commercial or publicationuse is strictly prohibited . Copying , redistribution ##355297 <p> Grubert began to make a name for herself collaborating with artists and theatre companies in Copenhagen	acknowledgment
acknowledgement/n/wlp_ca_g05/20276610	Project Atmosphere Canada Teacher 's Guide has been duplicated or adapted with the permission of the American Meteorological Society ( AMS ) from its Project ATMOSPHERE teacher guides . <h>	Acknowledgements	<p> The Meteorological Service of Canada and the Canadian Meteorological and Oceanographic Society gratefully acknowledge the support and assistance of the American Meteorological Society in the preparation of this material	acknowledgement
acknowledgment/n/wlp_ca_g05/17650451	but to continue to obfuscate the truth and to persist in the false narrative of \" intelligence failure \" . The CIA in the document even tries to spin its	acknowledgment	that Iraq 's programs were dismantled and its WMD destroyed in 1991 by saying that this unilateral action left Iraq " unable to provide convincing proof when it later tried	acknowledgment
