id	left	target	right	lemma
guide/n/wlp_jm_b01/2575675	Service Industries ( JCSI ) , which is housed within JAMPRO , provided assistance with the legal registration of the BPIAJ through the instrumentality of its newly developed Association Formation	Guide	. <p> Minister of Industry , Investment and Commerce , Anthony Hylton , in his address to the gathering at the launch , welcomed the formation of the BPIAJ ,	guide
guide/n/wlp_jm_b01/5767016	about the contents of this E-e-book apart from the recommendation I might get from a superb friend ? Since there have been just a few negative opinions posted about this	guide	and it ? s practically unimaginable to know which evaluations are real , the consumer might have to simply use their own common sense in deciding if this can be	guide
guide/n/wlp_jm_b01/10710839	European discovery . Your ride will end at Santa Gloria Bay , where you 'll get a little wet as the horses get neck deep in the ocean . Tour	guides	accompany you , and helmets are available upon request . <p> On arrival at the beach , refreshments are served in the @ @ @ @ @ @ @ @	guide
guide/n/wlp_jm_b01/1376765	through out your many incarnations , it has to stop at some point in time , and be promoted to another realm and no more travel to earth as a	guide	.... this is how you kill it by allowing the sins of the flesh to rule your head , and not being all that you were meant to be ,	guide
guide/n/wlp_jm_b01/7916223	was n't really \" The Falls \" ... yet ! <p> Heading into the Falls <p> The boat ride is included in the entrance fee . We had an awesome	guide	, who asked if we wanted a \" wet or dry trip \" . As I was holding our 1 yr old baby , I was n't quite sure ,	guide
guide/n/wlp_jm_b01/6971537	get married , looming big on the event horizon it seemed the perfect time to complement our status as one of the Top 10 Green Wedding Destinations by publishing our	guide	to the perfect green wedding ! <p> Planning a wedding , green or otherwise , in a foreign destination inevitably adds some extra complications to the process , so it	guide
guide/n/wlp_jm_b01/7044630	none of which I could afford . \" <p> The volunteer group consists of doctors , nurses , pharmacists along with other adults who act as assistants , councilors and	guides	, as well as children . <p> \" I volunteered to be on this mission trip to Jamaica just so that I could get a chance to help persons and	guide
guide/n/wlp_jm_b01/9703705	walk in the water . Even more quickly cash was removed from our wallets , but what the hey , it was worth it . Our self styled \" tourist	guide	\" ( I kid you not ) had the pre requisite rasta dreads and a really cheerful demeanour and he took us through the woods by the shore until we	guide
guide/n/wlp_jm_b01/745896	, Indonesia , and Japan . <p> \" China has the most modern paper mills and buys a lot ##3668906 <h> BlackBerry 9800 ( Torch 1 ) main ribbon change	guide	<p> Hey again peeps ..... gon na try my very best here to show you via pictures and narration , how I personally went about changing the main ribbon in	guide
guide/n/wlp_jm_b01/5771072	cloth over top or just hold the iron close . With some yarns , keep a little distance between the iron and the yarn ; let common sense be your	guide	. <p> Now remember , if you are using delicate yarn , christian louboutin sale , or one of those fun fur , ribbony types , use a wet spray	guide
guide/n/wlp_jm_b01/11193515	prosecution , the defense , and forensic science , and their collective expert knowledge , experience , and dedication to the task made this effort a success . <p> The	guide	is one method of promoting quality crime scene investigation . The type and scope of a @ @ @ @ @ @ @ @ @ @ Jurisdictions will want to	guide
guide/n/wlp_jm_b01/6677190	was the first time I was on my own in Jamaica . This created an odd feeling , for the first time I was exposed even though my friends and	guides	were only a few hundred yards away . Since my tour was someone ruined by watching all of the videos on YouTube , I will leave out the actual details	guide
guide/n/wlp_jm_b01/3834012	the whole purpose of buying skinny jeans ! <p> If you are n't sure what size Curve you are , Levis offers free measurements in their stores and has a	guide	on their website . You may find that the Curve IDs are a little on the pricey side on the Levis website . If you shop ##3673459 <h> The Skinny	guide
guide/n/wlp_jm_b01/6046442	music mastering is one of the indispensable processes because it not only provides proper shapes to the tracks but also improve the quality of tune ##3676016 <h> Australia Traveller 's	Guide	<p> From the hot colors of the Great Barrier Reef to the red dirt in the hub of the heart of the outback , Australia is a natural wonderland .	guide
guide/n/wlp_jm_b01/7944965	of the genre of the memoir . <p> She could n't hide forever . Animal trainer Angela London had never stopped looking over her shoulder . Her extraordinary skill with	guide	dogs had won her a handsome celebrity client , ex-football player Brian Ramsey , and helping him cope with the loss of his vision was awakening powerful feelings in her	guide
guidebook/n/wlp_jm_b01/10008524	guidebook is very complete and crammed with superb information regarding the best way to grasp the method . There are many unique issues which could be integrated inside of the	guidebook	. The technique is very scientific . <p> There are many pros to the @ @ @ @ @ @ @ @ @ @ way of training . This guide	guidebook
guide/n/wlp_jm_b01/10095762	and I have greatly enjoyed such discussions . <p> However , while in Israel last November I found myself in a somewhat different situation when chatting with one of our	guides	. She not only rejected the Old Testament but also did not believe in a living and personal God ( she said she saw aspects of godliness ' in everyone	guide
guide/n/wlp_jm_b01/10008800	all of the exercises . All you have to do is watch the detailed instructions on the video . <p> The program offers a full money back guarantee . The	guide	will come with a 60 days money back guarantee . This is a great offer , in the event you are not satisfied with the results . This also shows	guide
guide/n/wlp_jm_b01/1328392	worries before we go to bed , and the mind revisits the problems that plagued you throughout the day . Others are true messages given to you by you astral	guides	or you **26;1865;TOOLONG or whom ever you may have that may be living within the dimensions . Important is the time that you get the dreams or even @ @	guide
guide/n/wlp_jm_b01/11196318	which a draft copy of the document was sent . <h> Training Guide <p> The national crime scene investigation project includes tasks to develop training criteria to fit the investigative	guide	. For each of the investigative tasks presented in this document , minimum levels of performance will be developed and verified by TWGCSI members . This training @ @ @	guide
guide/n/wlp_jm_b01/5100022	what kind of beach activities you enjoy , you are bound to find a beach that delights your taste for adventure , romance or laid-back comfort . Here is a	guide	to the best Jamaican beaches : <h> Doctor 's Cave Beach <p> The thriving tourist hotspot of Montego Bay ( Mobay ) is home to some of Jamaica 's most	guide
guide/n/wlp_jm_b01/6438108	Highway , where huge bamboo trees form a vaulted arch along a mile of road in one of Jamaica 's unique scenes . <p> But if one of the amateur	guides	tries to take you to Lover 's Leap at the foot of the Santa Cruz Mountains south of Black River , it might be wise to decline . It 's	guide
guide/n/wlp_jm_b01/9477567	, Jamaica Tyler ( Texas ) Junior College Glenmuir H.S. Was tabbed as a first team National Junior College Athletic Association ( NJCAA ) selection as a sophomore ... Helped	guide	Tyler Junior College to the 2009 and 2010 National Championship while also leading the Apache to a 42-consecutive game unbeaten streak and a 41-0-1 record during his two years ...	guide
guide/n/wlp_jm_b01/8743598	check out other reviews of Samsung DLP HDTVs in particular , then visit the DLP TV Review at dlptvreview.com . The DLP TV Review website includes their handy 8 Step	Guide	to Buying a DLP TV , and they also have the latest news and a top ten list of DLP TVs . In addition , there are useful articles on	guide
guide/n/wlp_jm_b01/7710083	<p> #3 . Agree on what the tour will consist of and what the optional extras are . For example , hiking up into the village or having the tour	guide	take you up into the mountains would be extras . <p> #4 . Agree on how long the tour will last . You might end up wanting to soak in	guide
guide/n/wlp_jm_g01/12521633	All . He was acclaimed for his focus on family values and once revealed : \" Di yute dem haffi show respect and remember seh dem parents a di real	guide	. Me never diss my mother yet cause a she a mi real inspiration and if the yute dem inna the society focus pon that and transfer it to dem	guide
guide/n/wlp_jm_g02/3982480	guides \" and they are NOT necessarily going to know better . They may think they are doing exactly the right thing ( and we all know those \" tour	guides	\" can be quite convincing ) ! Hell , someone might be coming there for just the blue hole and the cave ( never hearing about Benji 's until they	guide
guide/n/wlp_jm_g01/2421342	too , but you see the Europeans , you see the Germans , the Italians , they come and they will cry . If you ever speak to our tour	guides	and get the stories of people who start to cry while doing the tour ! <p> \" What is another interesting thing about the museum is that we get people	guide
guide/n/wlp_jm_g01/12800221	by the high adrenaline ride of the Zip Coaster -- the first roller coaster zip line in the world ! Your experience will be fun filled and unique , your	guide	will educate you on the Mayan Culture and the Yucatan Jungle . Book online today ! <h> Prices : <p> Adult : $199 USD Child : $199 USD <h> Average	guide
guide/n/wlp_jm_g01/15585814	times when based on the level of the students , the teacher has to make adjustments to strands in the official curriculum as the curriculum is meant to be a	guide	. <p> Richards strongly believes that the teacher gets out of the students what he/she puts in . She warned that teacher practitioners must always be mindful of the hidden	guide
guide/n/wlp_jm_g02/8789546	Journal is authorized to reject abstracts or papers which do not meet the standards of the IAGt . For more details see Guide for authors and The benefits . <h>	Guides	for authors <p> Abstracts and articles should be submitted to the Editor in electronic form . Abstracts ( max. 100 words , Times New Roman , 12 pt. , pdf	guide
guide/n/wlp_jm_g01/1264868	start learning within seconds ! <h> Plus , anyone can afford it . <p> For the most @ @ @ @ @ @ @ @ @ @ with audio companion	guides	and that we 've spent hundreds of hours developing , you might expect us to put a hefty price tag ##1349441 <h> Button Bay -- Treasure Beach <p> Button Bay	guide
guide/n/wlp_jm_g01/11192822	the falls . <p> ( 1 ) Departing after breakfast from your place of stay , you are picked up by air-conditioned transportation . Our experienced happy , qualified driver/tour	guide	will inform you of the fantastic areas as you travel through the little villages of Jamaica . You will not just be taken along the coast road but in fact	guide
guide/n/wlp_jm_g02/6876222	endeavor and do n't @ @ @ @ @ @ @ @ @ @ the task you 're about to undertake . You 'll have to get a hold of	guides	to literary agents , publishers and editors to be able to find your way to the right person . From now on a part of your time must be dedicated	guide
guide/n/wlp_jm_g02/12133550	. My driver , Alfonso , was reliable , infromative , and really went the extra mile to accomodate us as tourists . We were luckiy to have a great	guide	, Vivian , through the rainforest too . He sang us Bob Marley : ) It was great . Thank you again for a great vacation at have the cost	guide
guide/n/wlp_jm_g02/14933758	, fees , fares and port charges ; passports ; visas and vaccinations ; transfers ; tips to your Tour or Cruise Director , Local Host , driver , Local	Guides	, and/or ships ' crew ; gratuities on ferries , trains , and cruise ships ; laundry ; telephone ; minibar ; alcohol , beverages , and food outside of	guide
guide/n/wlp_jm_g02/9526570	Your ears are for listening , I told you not to go wondering , Anyway , where are they , show me ? \" I suddenly felt like the Tour	Guide	of Coconut Park , leading the adults to moments of revelation . Once there , Granny allowed Mr. Pemberton to have his say and then she interjected . \" Let	guide
guide/n/wlp_jm_g02/13825961	latest trip April 2011---he gave us a couple of taxi rides around the beach area at reasonable prices in a clean , nice car . He also is a tour	guide	for Dunns River Falls and other attractions near Negril----he can also pick you up at Mobay airport for the ride to Negril charging from $60-80 depending on how many ......	guide
guide/n/wlp_jm_g01/8579154	or in bad weather . This route is currently not open due to road blockages caused by major landslides that have occurred during the last 2 years . Although most	guide	books describe this route , they may not have been recently updated and therefore do not contain the most current information . <p> Montego Bay to Port Antonio <p> The	guide
guide/n/wlp_jm_g01/11191184	<p> A truly fun and memorable equestrian experience for the whole family the horseback tour is .... the horseback tour is an enjoyable two-hour ride with our accomplished and trained	guides	who will select a horse to suit your riding ability . The ride commences from the Stables and you are taken through the scenic countryside , passing tranquil farmlands of	guide
guide/n/wlp_jm_g02/13051558	are hindering the road that we would liketo travel @ @ @ @ @ @ @ @ @ @ ( 1997 ) , Introduction to Sociology -- Social Sciences Study	Guide	. UWI : DEC , Barbados . Haralambos , M. , &; Holborn , M. ( 1995 ) , Sociology -- themes and perspectives . London : Collins Educational .	guide
guide/n/wlp_jm_g01/14870023	Elva for making it all the more special . We were thoroughly spoilt and very well looked after . George also deserves a mention for being a great driver and	guide	and for being very patient with us . <p> We look forward to receiving the link so that we can post a review . <p> We will definitley be returning	guide
guide/n/wlp_jm_g01/5694565	less clear cut in some triplets as in others , and the bracketed indicators become downright muddled for some of the triplets , so consider these to be only approximate	guides	-- in fact , @ @ @ @ @ @ @ @ @ @ , and a title or short description appears with the authour 's name ( with a	guide
guide/n/wlp_jm_g02/8406116	particular relationship , after these faults are exposed . <p> d ) If your camp site is in a protected animal reserve , your failure to follow camp-site rules ,	Guide	or Rangers ' instructions will lead to animal infiltration of your camp ... it 's not a great experience confronting a bear . <h> 5 ) Visit a Historic/Heritage Site	guide
guide/n/wlp_jm_g01/9469621	visitors through shallow sea waters to Seville Great House and Heritage Park . The offered tours are suitable for all ages and for riders of all levels of expertise .	Guides	are available to inform riders about the history and culture of the Taino people , the first Jamaicans . <p> 10 ) Ocho Rios Dolphin Encounter At the Dolphin Encounter	guide
guide/n/wlp_jm_g02/11623426	Negril Light House Perhaps the most distinctive landmark in Negril . Built in @ @ @ @ @ @ @ @ @ @ Rhodes Hall For horseback riding , expert	guides	will ensure your mount is right for you whether you are a novice or an experienced rider . A two-hour ride takes you through banana and coconut groves and high	guide
guide/n/wlp_jm_g02/9182704	and pools to form . This is where having a good , experienced guide is important . Many herbs and medicinal plants can be found along the trail as your	guide	shows you how Maroon Warriors used to live off the land . Having good footwear is very important . <p> A large open area called Big Ground on the way	guide
guide/n/wlp_jm_g01/9593431	@ @ @ @ @ @ @ @ Villa . <p> T. Davis - Check Seagrape on the cliffs , the main ##1371926 <h> resources <h> about us <h> Travel	Guide	<h> Travel Advice Q &; A : Do They Stamp Your Passport in Jamaica <p> Published Sep 17 , 2012 <p> We asked our facebook fans to help answer a	guide
guide/n/wlp_jm_g01/5486306	equals $8-$9US each way . <p> From the Car Park in Black River , its a few minutes walk to the docks . Cross the bridge and look for a	guide	, usually a guide will find you . I ask aroundA for a @ @ @ @ @ @ @ @ @ @ character who knows the Black River Morass	guide
guide/n/wlp_jm_g02/13815253	the @ @ @ @ @ @ @ @ @ @ , and want a more local and authentic experience , find Sexy Rexy 's Bar . This Jamaican tour	guide	has quite the following , an he seems to know everyone in Negril , tourist or local . Drinks are cheap , music is bumping until 5am , and you	guide
guide/n/wlp_in_b02/2950146	banned in lot of countries . Eating or drinking while using the stop smoking habitrol gum is not as a ##3398943 <h> Psychology : More than a subject <p> Student	Guide	for student who want to learn and peruse degree in Psychology . <p> W e often experience moods of anger and joy . We do have remarkable ability to learn	guide
guide/n/wlp_in_b02/14147810	have resided at various locations in Indian and I have to consent with you with all the factors . I particularly like the way how guides are traded . Old	guides	and magazines can be traded for another old guides.Visit my site drug rehab Drug Rehab recently posted .. Luxury Drug Rehab Centers <p> India has a vast variety in their	guide
guide/n/wlp_in_b02/15744866	the room , and he sits where the narrow stream of light falls upon the threads of his weaving . <p> \" Thus , \" we are told by the	guide	, \" do we secure our choicest products . Lace is always more delicately and beautifully woven when the worker himself is in the dark and only his pattern is	guide
guide/n/wlp_in_b01/11756938	said that achieving one 's goals is all within everyone 's reach . <p> In his new book ' Play a Bigger Game ' , Rowdy McLean has given a	guide	to achieving , doing , being and having more . <p> \" We all want more . More money , more love , more time , more chocolate , more	guide
guide/n/wlp_in_b01/3324471	within a valley . But only those seeking truth will ever reach the summit . \" <p> We start early , at 7 a.m. sharp . Deepak , the lead	guide	has informed ( or warned ) us that if we make it to the summit high-camp in one piece today , then we could climb the summit later in the	guide
guide/n/wlp_in_b01/10161249	and freely @ @ @ @ @ @ @ @ @ @ CSS and More Eric Meyer on CSS ( New Riders ) , Cascading Style Sheets : The Definitive	Guide	( O'Reilly ) , and CSS2.0 Programmer ' s Reference ( Osborne/ McGraw-Hill ) , as well as numerous articles for the O'Reilly Network , Web Techniques , and Web	guide
guide/n/wlp_in_b02/702723	innovative apps are also included , @ @ @ @ @ @ @ @ @ @ Official London 2012 Join In app plays a role not only as a pocket	guide	to Olympic games , but also as a guide to London itself . This app is useful in both the situation , whether you are watching the games from home	guide
guide/n/wlp_in_b01/2239236	hundreds of guides available that give a detailed ' how to ' guide on where to start . For those that do n't have time to read two hundred page	guides	, have a read below for the beginners guide in a nutshell . Yet to join Instagram ? We also have a few tips for you too ! <p> You	guide
guide/n/wlp_in_b02/6956404	, adding , \" Studying Hindi does not mean ignoring Tamil . \" <p> On Thanikachalam Road , R Krushnamurthy , a Hindi bookseller , says the demand for exam	guides	is slowly rising , but that of Hindi novels and reference books is not . \" I started selling books in 1990 . In 1996-97 , I was selling 10,000	guide
guide/n/wlp_in_b02/12322300	business you can automate and grow your business at the same time : <p> @ @ @ @ @ @ @ @ @ @ delivery of digital products and free	guides	for visitors interested <p> c ) Take control of credit cards online <p> d ) Use a smart e-commerce system that automates the sales process <p> e ) Provide instant	guide
guide/n/wlp_in_b02/13039815	. And another important feature is comes with 800 MHz processor . <h> Warning : <p> We are not responsible for any damages that may happened due to using this	guide	to your phone . If any problem happened @ @ @ @ @ @ @ @ @ @ to solve it . <p> Use this guide at your own risk	guide
guide/n/wlp_in_b02/5965972	@ so well organized : <p> Diamond and ruby bazaar , hampi <h> The beauty is in the details and stories : <p> That 's exactly why you need a	guide	. They charge Rs.1000 for a 7-hour guided tour . They know the order in which the vast empire has to be covered . Take help , pay them ,	guide
guide/n/wlp_in_b01/6235397	good reference books but every child is unique and a mother must follow her instincts to decide what is best for her child . The books will only act as	guides	to help you take informed decision . They are generic . Only you know what is best for your child or what your goals are . <h> 2 comments :	guide
guide/n/wlp_in_b01/4582062	top of the cylinder , while air is removed through a bleeder . <p> A different cylinder design should be used where the car or platform does not operate in	guides	. One type capable of taking off-balance loads employs a twobearing plunger ( Fig. 16.16b ) . The bearings are kept immersed in oil . Another type , suitable for	guide
guide/n/wlp_in_b01/12562624	ratio over time for each company . <p> P/E ratios vary by the industry . <h> P/E Ratio in Investment Decisions <p> How can the P/E ratio be used as	guide	in making an @ @ @ @ @ @ @ @ @ @ apply various rules of thumb on company 's earnings selecting an appropriate P/E ratio to determine the	guide
guide/n/wlp_in_b01/6520828	along with pocket . Finally a good old ( really good and really old ) lady pointed at a half shut door in a lane and said , ' English	guide	' through her empty dentures . May god bless her soul in person , I muttered , as it would n't be long she would meet the creator and hurried	guide
guide/n/wlp_in_b02/11768063	hours . <p> Concurrently , the applicant is granted quick fiscal aid particularly in times when there is an anxious urge for fulfilling demands . There are financial specialists which	guides	you in filling in the form in the online method for instant personal loans . The form should be filled with facts like income , address , name , and	guide
guide/n/wlp_in_b02/37966	turned this feasible for one to be a released writer . You do n't have to employ the author or perhaps lb the particular sidewalk looking to get your own	guide	released . You are able to distribute and find out how you can compose your own e-book your self i den hensigt at minimum price . <p> Exactly why Might	guide
guide/n/wlp_in_b01/3144239	. Some people are also discouraged by the fact that it 's a predominately vegetarian and dry state . <p> However , reading India Guide 's newly released Gujarat travel	guide	has vastly changed my perception . Gujarat is actually a very underrated tourist destination , particularly if you 're someone who likes to take the road less traveled and immerse	guide
guide/n/wlp_in_b01/14389019	start writing a specification before I do anything else . Writing a specification is n't a necessary step for creating a custom HTML helper , but it gives me a	guide	to how the HTML helper will function and what the desired syntax will be . A spec will also promote the use of semantic code , which improves discoverability for	guide
guide/n/wlp_in_b01/9171480	you wil need start viewing messages , select the forum start viewing messages , select the forum that you want to visit from the selection below . <h> The Complete	Guide	to Starting a Website <p> Since there was a large increase of members to BHW , and there are members who are brand new to the online business , so	guide
guide/n/wlp_in_b02/4050793	<p> \" After having a miscarriage at 12 weeks , and having waited for that pregnancy to happen for more than a decade , I found REAL comfort in your	guide	as it made me made me realize EXACTLY what I was doing wrong @ @ @ @ @ @ @ @ @ @ needed to do in order to dramatically	guide
guide/n/wlp_in_b01/10061469	as you just because of their physical disability or the elderly aged what makes them weak due to various diseases and complications . <h> Elderly people 's Experience , your	Guide	<p> Yes it 's a fact that you will always need elders to guide you and support your future because they have one thing @ @ @ @ @ @	guide
guide/n/wlp_in_b01/6343583	are ceramic chip capacitors in 0805 packaging ( or 0603 since they will also fit perfectly fine ) . They should be rated 16V or greater . <p> This assembly	guide	also contains some notes about the various areas on the circuit . <h> Microcontroller <p> The ATmega644PA obviously must be installed , solder in a 40 pin DIP socket so	guide
guide/n/wlp_in_b01/13168603	can give rise of noncancerous tumor which can turn out to be quite dangerous . <h> Are you depress due to not getting pregnant ? <p> Check out our holistic	guide	with natural solution . A certified and successfully used by many to get pregnant in 1 or 2 months naturally in any age . No need of surgery or drugs	guide
guide/n/wlp_in_g03/10853321	guided instruction , \" he said . <p> \" You can start with a sage on the stage and then slowly start taking away the support structure and become a	guide	@ @ @ @ @ @ @ @ @ @ The US Professors of the Year Awards Program was created in 1981 and is the only national initiative specifically designed	guide
