id	left	target	right	lemma
guide/n/wlp_in_g01/7634352	@ @ in its maiden appearance , surpassing global giants such as Apple , Samsung , Dell and Nokia among others . According to the 18th version of Greenpeace 's	Guide	to Greener Electronics , Wipro has topped the list of 16 electronic companies across the world based on their commitment and progress in three environment criteria : energy and climate	guide
guide/n/wlp_in_g03/324546	crackles with a strange energy , Wolfboy meets a stranger at the Diabetic Hotel . She tells him her name is Wildgirl , and she dares him to be her	guide	through the endless night . <p> But then they are mugged by the sugar-crazed Kidds . And what plays out is moving , reckless ... dangerous . There are things	guide
guide/n/wlp_in_g03/2780601	detrimental to Tibetan culture . When Kumbum monastery near Xining , Qinghai 's capital , was singled out for tourism , it saw an influx of female Han Chinese tour	guides	. <p> The resulting temptation for some of the monks winnowed their numbers , as did some of the other sorts of interference that tourists and their cash can bring	guide
guidebook/n/wlp_in_g01/17521325	your answers . Doing so will help you recognize which types of questions are easier for you and @ @ @ @ @ @ @ @ @ @ specialized IELTS	guidebooks	to learn strategies to help you with ones that are more challenging . <p> IELTS READING - SKILLS To do well in the IELTS reading test , you need global	guidebook
guide/n/wlp_in_g02/5838790	research and ideas . School tiffin boxes and parties follow , not to mention eateries of every kind , but while these build pressure , the supermarket aisle is her	guide	and solution provider . Creativity and pleasure payoffs help resolve her dilemmas between cost and convenience , health and taste . <p> But as the college girl in the focus	guide
guide/n/wlp_in_g03/1004473	satisfied with my career direction which was influenced in large part by your coaching . Thanks again ! \" Mohammed Reyaz , Chennai , India <p> \" After receiving the	guide	I was able to access enough information about SAP to be comfortable to go on a job interview that had SAP as a plus for knowledge . \" Jim Vogel	guide
guide/n/wlp_in_g02/10265670	to visit the French capital that sprung up all of a sudden , giving the entire team very little time to research and plan the shoot . <p> Ambika 's	guide	on Dressing up for Wedding Ambika Anand Dressing up for weddings can be a lot of sweat and work , even if it is not your own wedding . I	guide
guide/n/wlp_in_g02/19682861	the moment the @ @ @ @ @ @ @ @ @ @ afterwards we were looked after so well . We had a team of 3 - a lovely	guide	Nurbu , talented cook Lakba and jolly horseman Angdu . They were so respectful ( we were 2 girls travelling on our own ) , informative , smiley and hard-working	guide
guide/n/wlp_in_g02/3617593	that leaders must increasingly resist the temptation to cope with chaos and complexity by trusting their gut . At a time of extreme volatility , past experience is an unreliable	guide	to future outcomes . Leaders must create cultures of constructive skepticism and surround themselves with people who bring multiple perspectives and have no fear of challenging the boss . <p>	guide
guide/n/wlp_in_g03/7340130	, I instantly agreed . I also did it for Sudhakar Sir . From the very first day of my career , he has been my friend , philosopher and	guide	. Sudhakar Sir has actually groomed me . Besides , it 's always an honour for budding stars like us to share screenspace with Anubhav bhaiya . <p> What do	guide
guide/n/wlp_in_g01/18023622	disoriented by so much visual grandeur . \" <p> Maurice Glaize ( 1886 -1964 ) was the conservator of Angkor from 1937 to 1945 . In 1944 he published a	guide	to the temples , entitled Les Monuments du groupe Angkor ( The Monuments of the Angkor Group ) , which is still widely read and used by visitors to the	guide
guide/n/wlp_in_g03/21749734	a picnic . You do not know anything about that city , as you have never been there before . What you do is to take the help of a	guide	to go round the city . You do not question the guide at any point since you are totally new to the place . So also , a Guru who	guide
guide/n/wlp_in_g01/12198441	. You can get a trial version of the database itself either by download from Microsoft or on the bundled CDROM that comes with several of the popular certification study	guides	. Visit Microsoft 's SQL Server homepage to get oriented . It contains support information , online forums , articles , utilities , and the like . <p> There are	guide
guide/n/wlp_in_g02/12081918	to take advantage of all UI and other features of Sailfish OS and make your applications fast , you can port your applications to native QT/QML . There are extensive	guides	available on how to do that . <p> I am definitely @ @ @ @ @ @ @ @ @ @ remarkable in a relatively short time . <p> Update	guide
guide/n/wlp_in_g03/18809662	deliberately refrained from making references to or relying upon decisions from other countries like the U.S.A. or Australia , because the cases decided in those countries can not be any	guide	for the solution of the problems raised in this case inasmuch as the framework of the Constitution in those countries is not in pari materia with ours . Any precedents	guide
guide/n/wlp_in_g02/9746575	this long process become intellectual in turn too . A third type is claimed to be disengaged but doubting the way , and therefore just in need of an explaining	guide	to get intellectual enough too . There is a stress on getting intellectual by evolving things that seem imperfect at first . Going for \" natural virtues , \" wisdom	guide
guide/n/wlp_in_g02/19359885	eliminate this ! ? <p> All Abouthow to enjoy living aloneTopto <p> how to enjoy living alone we are looking for a theme you want covered in the article 's	guide	! questions as , of interest , ##876155 <p> There are several different , and sometimes quite confusing statements that claim to be a definition of Knowledge Management ' and	guide
guide/n/wlp_in_g03/19890917	all men are not created equal when it comes to body type and clothing . Somewhere , though a perfect jeans is made for us . Here is a perfect	guide	to finding just the right pair of jeans for yourself . <h> Phone a Friend <p> If you 're too shy to go alone and get yourself a pair of	guide
guide/n/wlp_in_g03/24641307	as informative . The complex history of Northern Ireland was brought to life for us in a way that would have been impossible through any other means . The tour	guide	- being a native of Belfast - was highly informed , and was able to provide us with both wide-ranging historical information and personal anecotes regarding the turbulent political climate	guide
guide/n/wlp_in_g02/19681661	@ @ @ @ @ @ @ n't shake easily , and needed to see a doctor . Although we were no longer their responsibility , both Javeed and our	guide	( Achuk ) came with us and helped negotiate our way to a doctor who spoke English . They were genuinely concerned and keen to ensure that Matt got the	guide
guide/n/wlp_in_g02/7605590	@ @ @ @ @ @ @ @ not file as head of household if you are a nonresident alien at any time during the tax year . This IRS	guide	will serve useful . <p> \" Since Ramesh is single , his filing status would be single . But had he been married with kids his filing status would have	guide
guide/n/wlp_in_g02/19353826	as for should there is three.You expressed even with article \" self analysis \" , decision making Professor edoga Shine of thing namely the Massachusets Institute of Technology which obtains	guide	and the clue defined his own future to is to think of \" of the answering three questions \" . <p> Something is possible ? Ability talent it @ @	guide
guide/n/wlp_in_g03/22179249	is also featured on the Alltop Careers and Alltop India categories . Earlier the blog has been featured as a case study in the book Business Blogs : A Practical	Guide	Gautam 's experience in the corporate world was as a HR Manager at Deloitte &; Touche and earlier in the HR and Learning &; Development function in organizations like Dell	guide
guide/n/wlp_in_g02/25044503	Guide to Leadership and Power in Law Firms . http : //www.idaabbott.com <p> IdaAbbott at aol dot com <p> In my book , Women on Top : The Woman 's	Guide	to Leadership and Power in Law Firms ( Thomson Reuters 2010 ) , I explain that ambitious women need a special kind of mentor who serves as a champion or	guide
