id	left	target	right	lemma
parody/n/wlp_nz_g02/2475706	of mind that he conceived a new story , \" Tln , Uqbar , Orbis Tertius \" , which would appear in Sur in May 1940 . This was a	parody	of Bishop Berkeley 's philosophical idealism , in which the members of a secret society run by a millionaire called Ezra Buckley invent an imaginary planet called Tln whose inhabitants	parody
parody/n/wlp_nz_g02/10838093	tossing about a few \" futuristic \" touches as window dressing but not really examining their implications . Steyngart 's future setting in Super Sad True Love Story is a	parody	of the present , played largely for laughs , but at the same time he seems to want to say something about the erosion of relationships in an age of	parody
parody/n/wlp_nz_g03/20579139	theatre . <p> Lucy Marinkovich 's Vile Bodies is her first work for Footnote . Some ' bright young things ' take their personal grooming very seriously in this playful	parody	of images from pop culture . The lighthearted fun is counterpointed by the amusing lyrics of the sound mix from James Dunlop . The moments that capture obsession with glamour	parody
parody/n/wlp_nz_g03/12536829	sticking up for his fishing industry mates . He publicly attacked Gareth Hughes over Hughes ' copyright bill , despite Labour supporting it , after taking exception to Greenpeace 's	parody	of a Sealord ad . And @ @ @ @ @ @ @ @ @ @ fishing issues . <p> David Shearer 's leadership of Labour would be looking a	parody
parody/n/wlp_nz_g02/8349564	decade for musical reference points , I would suggest some bastard child of the Stooges and Neu ! with a serious side of Zeppelin . Not when they were bloated	parodies	of rock n roll but when they were stomping their opposition into the ground with a glee the Pistols could only dream about . <p> But those reference points do	parody
parody/n/wlp_nz_g03/8017954	up in lamb 's clothing for a while , eventually , hopefully , we all start to notice that something is really not right . <p> 1flesh.org writes a great	parody	highlighting the , well , insanity to be found -- as if we did n't have enough ' global day of ... ' already ! <p> Movements , trends ,	parody
parody/n/wlp_nz_g03/10856427	existed and an album of the television documentary , or if you will \" mockumentary \" . <p> And he made almost nothing from it . <p> Despite being a	parody	and leaning heavily on Beatles riffs ( George Harrison not only appeared in the doco but assisted with genuine Beatles footage ) , the Fab Four 's publishers did n't	parody
parody/n/wlp_nz_g03/11799984	faced by high schoolers may not be what draw young children in , but the issues are there nonetheless , \" the article states . <p> \" Any hint of	parody	or sarcastic nuance is most likely lost on the very young ... Consider Sharpay , the brash and popular HSM schemer who wants heartthrob Troy to herself and makes dark-haired	parody
spoof/n/wlp_nz_g03/21579463	@ @ @ @ @ @ @ @ @ in fact a real person . \" ( NZ Herald , 31 October , 1995 ) <h> Callers angry over film-maker	spoof	<p> Not everyone chuckled at TVNZ 's spoof documentary on Sunday night . It drew an angry response from some viewers . A source at the network said close to	spoof
spoof/n/wlp_nz_g01/15987741	@ to some of its 80s pop culture jokes and celebrity cameos <p> In the same vein as Grindhouse , four filmmakers have come together to make an anthology of	spoof	horror films that homage the drive-in tradition ... Good taste is left well behind and he results are both outrageous and funny <p> Has almost nothing in common with the	spoof
parody/n/wlp_nz_g01/2915630	I 've teamed up with writing partner , Aliza Pearl Kennerly and we 've formed \" Increase Our Bust Comedy , \" which will consist of sketch videos , musical	parodies	and web series to be created under our joint production company Age 13 Productions . This past summer we co-wrote a pilot for a TV drama called , " Whitehall	parody
parody/n/wlp_nz_g02/12833059	this very clearly including a significant bruise . <p> The retrial and even the admissions by crown witnesses including police at that retrial show the prosecution case was a complete	parody	. The decision by the Privy reinforces this impression . If the Privy council cant spot a crock who can ? <p> Dr Don Mathias ' , a legal expert	parody
parody/n/wlp_nz_g03/16990293	, their published narratives , and captivity into account , Gulliver 's @ @ @ @ @ @ @ @ @ @ the common view of it as an uncomplicated	parody	of travelogue takes it to be . The connection of Swift 's work to an awareness about captivity and its implications is reflected even on the most basic level of	parody
parody/n/wlp_nz_g03/6906116	except ... we were now in the age of the mobile phone , and that killer could be anywhere ... <p> After endless sequels and even parodies of the original	parody	( Scary Movie ) , the satire has become as familiar as the thing satirised -- you know that the promiscuous girl dies first , the so-called " final girl	parody
parody/n/wlp_nz_g02/5141890	Blog Fiction <p> Mockorange <p> I feel that A dog is guaranteed at some point . <p> Well . . . yes . Kes is , after all , a	parody	of me -- Kestrel MacFarquhar ? Please . At the same time she 's had a life of her own since the idea of writing about her first occurred to	parody
spoof/n/wlp_nz_g03/14100607	school . How can he be too smart ? Are n't school kids supposed to be smart ? <p> Undoubtedly the most popular skits were the It 's Island Time	spoof	of a kids ' @ @ @ @ @ @ @ @ @ @ seconds , breaking into song with Eteuati on guitar and the trials of Tale Something-Hyphen-Smif (	spoof
parody/n/wlp_nz_g02/5142892	so I 'm glad you did n't . At the same time . . . how many birds begin with ' K ' ? If you 'd twigged that the	parody	was deliberate and , um , not very subtle . I had various friends trying to suggest more mild mannered birds and I was all , No ! She is	parody
spoof/n/wlp_nz_g02/9655679	a secret . After a few false @ @ @ @ @ @ @ @ @ @ as Lonny becomes increasingly frustrated by a failure to communicate . An over-the-top	spoof	of old time detective shows that makes the point , " always be honest " . ( Author : Glenn A. Hascall ) <p> Diversity Training : Two young Americans	spoof
parody/n/wlp_nz_g03/3811654	than has forgiveness . It has , in fact , become a scourge ; a curse where it was meant to bless , a cruel mockery of grace , a	parody	upon the holy peace of God . Yet those who have not yet chosen to begin the steps of prayer can not but use it thus . Forgiveness ' kindness	parody
parody/n/wlp_nz_g02/9687972	Pete turns Jesus and his forgiveness down throughout his life , until it 's too late . ( Author : Peter Harrison ) <p> Touched by an Athiest : A	parody	of the TV show , Touched by an Angel , showing the hopelessness of living without God . ( Author : John Cosper Jr ) <p> Toyshop Evolution : When	parody
parody/n/wlp_nz_g02/5148494	time . I 'm pretty sure Kes has at least one other series , and I 'm surer that she 's written a few one-offs . Mostly she 's a	parody	of me , but occasionally she 's a wish-fulfillment : she writes her stories a lot faster than I do . <p> Siiiiiiiiiigh . <p> But KES has three clear	parody
parody/n/wlp_nz_g01/19833562	with . In the porno-consumer world , we 're always doing ourselves , and we 're always doing it alone . \" ( Rob Horning ) <h> ? Is a	parody	of love - @ @ @ @ @ @ @ @ @ @ opposition to intimacy helps explain why porn has become so cruel , degrading and humiliating -- why	parody
spoof/n/wlp_nz_g01/9768829	has two other children . However , as with most gossip through the grapevine , it 's not quite true , and the Californian comedienne has simply starred in a	spoof	video while poking ... More ... <p> Jennifer Aniston continues to explore the magic of the Internet , this time with the help of some unborn triplets , a grown	spoof
spoof/n/wlp_nz_g03/2798706	team has an initial target of 1000 orders , and at the time of writing the counter on its website indicated they had 55 sales . <p> They have a	spoof	video of a girl dreaming of horse ownership , but settling on the Trotify , and another showing the realistic sound of the device ##1721975 <p> Renowned dressage coach Klaus	spoof
spoof/n/wlp_nz_g03/11190838	Post-war , there 's a look back at the nuns and girls from Erskine College 1949-50 , the farewell to trams 1964-65 , some hilarious BLERTA vignettes and Country Calendar	spoofs	re-released in 1999 . <p> Fans of film and the City we live in are encouraged to join the Film Archive for the special Christchurch Earthquake Relief presentation of From	spoof
