id	left	target	right	lemma
generalization/n/wlp_jm_b01/6365129	@ @ @ way . <p> Introduction of Mobile Phones <p> The best timing to make anything right is from the start . That may sound too much of a	generalization	but it is true in case of teen 's chances of getting mobile addicted . Parents must introduce smartphones to their children as a utility device which can keep them	generalization
generalization/n/wlp_jm_b01/6916632	of people , by the behaviour of one or a few members of that group . <p> To our readers who wish to be wiser ... continually using these faulty	generalizations	will make you seem like a dwarf among more sensible giants . : ) <p> You are forewarned not to use them ... if you wish to grow in stature	generalization
generalization/n/wlp_jm_b01/6916592	achieved by the West Indies on Thursday ) . <p> NB : For our younger readers , the above statement by Vic , is what is called a \" faulty	generalization	\" ... i.e. judging an entire population or group of people , by the behaviour of one or a few members of that group . <p> To our readers who	generalization
generalization/n/wlp_jm_b01/3249893	life is free . <p> A caveat to Jamaican Girl . I sense that you have some knowledge of economics , but be very careful in your wanton and gross	generalizations	regarding self respecting economist and economic growth benefiting people at the bottom.Because what it does , is to show that you are not thinking , and I know that you	generalization
generalization/n/wlp_jm_b01/841701	myself are in fact mixed or coloured . As well as a majority of the school being more brown than anything else . Please do your research before making sweeping	generalization	such as this Reply to this <p> As a Hillel Academy High School student thank you for confirming what I am saying in this piece . Children of the darkest	generalization
generalisation/n/wlp_jm_b01/10276012	it to ? For example , will research carried out in the United States apply to the Caribbean ? <p> Sample size -- Was the sample size large enough for	generalisation	to be accurate ? For example if a newspaper article has only interviewed one person in a large crowd can we assume that all the points of view are represented	generalisation
generalization/n/wlp_jm_b01/1657906	problem . You look at what i believe to be the best resource : HISTORY . But i do nt think you can lump the whole world together and make	generalizations	about the occurrence of violence like that . <p> Jamaica has had a very violent place since the arrival of the colonial powers . And by violence , i mean	generalization
generalization/n/wlp_jm_g02/7644392	security benefits , are really eligible to receive this type associated with loan . Available is something to help you be learned between each approach . As with whichever gender	generalization	, certainly there are always relegations and room for the improvement . Despite of whether the education rises in the form of investments , any uses of virtual payday loans	generalization
generalization/n/wlp_jm_g01/5661936	@ @ @ @ @ @ @ @ @ @ s ##1361403 <p> I t happens all the time , you hear someone over the telephone and you make a	generalization	about the person you are speaking with . It may not be fair and it is akin to judging a book by its cover , but it 's true nevertheless	generalization
generalization/n/wlp_jm_g01/7994541	Sorry I did nt get to all your questions .. kind of just spoke in general ... <p> Yaadie- Thanks for your perspective ! Even though it requires offering some	generalizations	, I am always glad to hear how Americans are perceived by non-Americans . Keeps us more honest if we can admit truth in what others see ! Cheers There	generalization
generalization/n/wlp_jm_g02/1659104	bone .. i will always have my pum dj'ing skills to hold me over between sessions . <p> Not generally interested in merely casual sex at this juncture . The	generalization	that women use sex for love , and men , love for sex , tends to unfairly influence one 's perspective whilst discussing whether or not women can separate emotion	generalization
generalization/n/wlp_jm_g01/6916361	the world ... where a project elsewhere can attract hundreds of researchers , very often the Caribbean researcher is happy if they can find ten ... this is obviously a	generalization	, but I think the point is clear - we do n't have a large number of researchers , access to specialised instruments is often preclusive , funding is scarce	generalization
generalisation/n/wlp_jm_g02/3960674	the laptop ( on maternity leave ) while he 's working on a cold construction site every day to pay our bills . I suppose it goes to show sweeping	generalisations	( n't cover every story . <p> Re : " Do n't tell your man you have money " <p> oldtimer 4/15/2011 , 4:43 am <p> tucz said " there	generalisation
generalization/n/wlp_jm_g01/7977281	of one of those things \" I laughed ... it was funny . He is mostly right . Are their exceptions ? Yup .... are their tendencies they make that	generalization	something people can relate to ? yes .... <p> And while i am on this tyraid ..... I should Go find some Alex quotes where you lump all JA men	generalization
generalisation/n/wlp_jm_g01/13645392	. Unfortunately , these are also the kind of books which dominates the shelves of any university or public library in Africa . The reader is invited to test this	generalisation	. J. D. Bernal , Science in @ @ @ @ @ @ @ @ @ @ of 45 ) 8/22/05 11:03:07 AM <p> How Europe Underdeveloped Africa . Walter	generalisation
generalization/n/wlp_jm_g01/4034049	says to and/or about you , it 's because you feel , somewhere deep inside , that they 're right . The only time someone outlashes about a stereotype or	generalization	is because they ##1356749 <h> Posts Tagged ' Apple ' <p> While as you can see above , Siri was n't able to adequately answer my question ; whether the	generalization
generalisation/n/wlp_jm_g01/7868657	area of operation at @ @ @ @ @ @ @ @ @ @ the broader implications of what is being proposed , managers are trying to make wider organisational	generalisations	, abstract propositions , more particular . And in doing so they can make the difference between a poor or a better implemented initiative . Their group of peers will	generalisation
generalization/n/wlp_jm_g01/13460572	the most affluent of the ferent environments to which they year 985 . In 1001 his son Leif is Hemisphere . The ensuing discover-pre-Columbian Native Americans had dapted . Some	generalizations	, thought to have explored the north- ies added to Europe 's knowledge oflived in the Pacific Northwest , where however , are possible . Most tribes , east coast	generalization
generalization/n/wlp_jm_g02/12494841	area , and research efforts have been diffused by examining the issue using numerous measures in three competitive settings - marching band , concert band and solo/ensemble festivals , several	generalizations	may be made concerning competition in band programs . First , in spite of numerous negative commentaries found in the literature , attitudes concerning band competitions appear to be positive	generalization
generalization/n/wlp_jm_g02/537089	of time and most times the study has to be confined to a small group thus at times making the sample non-representative of the population under study and so accurate	generalizations	can not be made . To conclude qualitative method of research provides the research with the use of statistical data thus making it easier to study phenomenon where the direct	generalization
generalization/n/wlp_jm_g01/15186233	, not regular , since at chromium and copper the population of 3d orbitals increase by the acquisition of an electron from the 4s shell . This illustrates an important	generalization	about orbital energies of the first row transition series . At chromium , both the 3d and 4s orbitals are occupied , but neither is completely filled in preference to	generalization
generalisation/n/wlp_jm_g02/6415361	would thus still appear to depend on where you sit and this necessarily makes comparability between countries difficult to determine ( statistically and otherwise , for example in terms of	generalisation	and policy recommendation ) . <p> The other is Cuba and more marginally Haiti . It is difficult to include Cuba in any study of development without recognising its unique	generalisation
generalization/n/wlp_jm_g01/7977482	wo n't . Hence the old saying \" why buy the cow ........ blah blah ... you know the rest . This debate is so old .... sometimes we make	generalizations	Alex ...... and there are definitely cultural differences that create tendancies towards different behavior ..... no one is suggesting there is a cookie cutter ... especially not me . <p>	generalization
generalisation/n/wlp_jm_g01/1069721	it to ? For example , will research carried out in the United States apply to the Caribbean ? <p> Sample size -- Was the sample size large enough for	generalisation	to be accurate ? For example if a newspaper article has only interviewed one person in a large crowd can we assume that all the points of view are represented	generalisation
generalization/n/wlp_jm_g01/7105386	Hitler , and Pa Pa Doc Duvalier . These were leaders who started off by painting Jews , Mulattoes , and Asians with the same brush , using similar broad	generalizations	. This then developed into something much more ominous . <p> The claim that Caribbean peoples from , ' down the islands , ' have a bad attitude is a	generalization
generalization/n/wlp_jm_g01/5402158	enjoy it . Topology can be thought of as a kind of generalization of Euclidean geometry , and also as a natural framework for the study of continuity . This	generalization	is achieved by regrding triangles , circles , and squares as being the same basic object . Continuity enters because in saying this one has in mind a continuous deformation	generalization
generalization/n/wlp_jm_g01/447118	@ @ @ @ centrality . What I mean is pretty simple . In the Middle Ages , and even up to Napoleon -- and I 'm making a huge	generalization	-- the artist was necessary to produce the images for the church , for the emperor , for power . The artist was working for himself , but he was	generalization
generalisation/n/wlp_jm_g01/16441632	@ @ @ @ @ @ @ @ @ @ a lot of whiskies out there with sweeter , floral flavours . <p> But it 's too much of a	generalisation	to say that you have to have a sweeter taste for women to like a whisky . It 's really down to individual taste , and there are around a	generalisation
generalization/n/wlp_jm_g01/5402140	a course to relax at ; though this does not mean that you will not be able to enjoy it . Topology can be thought of as a kind of	generalization	of Euclidean geometry , and also as a natural framework for the study of continuity . This generalization is achieved by regrding triangles , circles , and squares as being	generalization
generalization/n/wlp_jm_g02/11147880	which the supply of alcoholic liquor , if any , is ancillary , as a separate unit or as a part of an hotel or another establishment . Beyond this	generalization	some restaurants operate under designations such as cafes , snack bars and the like ; in some @ @ @ @ @ @ @ @ @ @ regulated by law	generalization
generalization/n/wlp_jm_g02/537447	since it searches for relationships between phenomenon , it is empirical because it uses statistical data and is based on facts and it is cumulative because it seeks to make	generalizations	based @ @ @ @ @ @ @ @ @ @ , extends and refine older theories . In addition , Sociology follows process such as observation , experiment and	generalization
generalisation/n/wlp_jm_g02/4842202	go into politics do n't go in because they want to make Jamaica a better place , they go in because they want money and power . It 's a	generalisation	, yes , but I think it speaks for itself and corruption is what happens when you get to that . " <p> Matalon -- " It 's said that	generalisation
