id	left	target	right	lemma
story/n/wlp_ca_g05/9498465	East . <p> @ @ @ @ @ @ @ @ @ @ adventurer of the Indiana Jones ilk who lives secretly but loves the publicity garnered from his outlandish	stories	. His stand is not anti-Israel as much as pro-Arab . He feels as most that a reactor would benefit Iran through electricity that would enrich the state . He	story
story/n/wlp_ca_g01/18550257	qualify as a \" reason \" in this context . <p> To do so lets consider the situation faced by a robot called \" Robbie \" . Recalling the robot	stories	of Isaac Asimov ( or the android Data from Star Trek : The Next Generation ) , picture Robbie as a humanoid robot with a " positronic " brain --	story
story/n/wlp_ca_g01/9651153	eventually @ @ @ @ @ @ @ @ @ @ her help he embarks on the long and twisted road back to sobriety and self-respect . <p> Though the	story	of Campbell and Eileen is essential to the flow of the memoir , it does not follow in a chronological timeline but is told in flashbacks , with most of	story
story/n/wlp_ca_g01/2935531	was going to be more compelling as a story was trying to reflect that experience of making the film . You as the audience kind of follow all of these	stories	simultaneously . You set off on the sister 's journey with her when she sets off . Every time we are introduced to a new contributor , it 's when	story
tale/n/wlp_ca_g02/12976455	do n't doubt that it did nothing to cure you of a preconceived notion that your life is greater than that of another . Really . The title of your	tale	should be nothing short of " How I risked my life and the lives of others during a full on blizzard in Southern Alberta . " You , sir ,	tale
story/n/wlp_ca_g05/1654923	with the terrific yarn about making a movie that gets the Americans out of Iran . The Hollywood sequences , often humorous , are all about creating fantasy and telling	stories	and sparking the imagination , and those sequences are contrasted with the grim political realities in Tehran . " And what I like about all that , " says Affleck	story
story/n/wlp_ca_g02/14743259	This is how it comes to me . <p> The young sister with rosy cheeks , in white religious garb , surrounded by us kindergarten kids , telling us the	story	of St. Francis . My running out and clapping my hands at St. Francis and saying , " I will be like you . I will be very poor ,	story
tale/n/wlp_ca_g05/4292833	online counsellor may wish to speak with your existing ##146892 <h> Another giant-killing cup run for Quevilly - all the way to the final <p> It 's a footballing fairy	tale	- take two . The exploits of French third division side Union Sportive Quevillaise <p> You might remember a couple of years ago the team of Quevilly made it through	tale
story/n/wlp_ca_g05/885060	to introduce Scouts to singing , not Scouts ' Own . These elements also need not be combined in a manner that resembles a church service . When telling a	story	or parable , one need not explain its meaning . A parable hides the truth from those who are listening until they are ready to understand it . The @	story
story/n/wlp_ca_g02/11532145	@ @ @ @ in and day out . They will still be here when I go back to my life in Surrey . But I will not forget their	stories	, their smiles , and their encouragement that keeps me motivated to finish the rest of the MLA Welfare Challenge . <h> 4 thoughts on " Constituents day " <p>	story
story/n/wlp_ca_g05/12190656	? \" or the anthemic , mournful title track are both throwbacks to a classic era before country and rock and roll went their separate ways and timeless in the	stories	the songs tell and the emotions they evoke . <p> Despite releasing two albums , garnering critical raves and touring extensively around North America , The Blue Shadows never managed	story
story/n/wlp_ca_g01/16599286	but first I have several other stories I 'm going to tell first ... <p> Where do you get your ideas ? <p> From anywhere and everywhere : a newspaper	story	, a conversation with friends , a place I 've visited or seen pictures of , other people 's stories ... For me the hard part of writing is n't	story
story/n/wlp_ca_g04/15376715	a page I have noticed dozens of times during previous mind wanderings in @ @ @ @ @ @ @ @ @ @ 1960 front page that blasted the amalgamation	story	across the top , for crying out loud ! <p> Talk about not seeing the forest for the trees . <p> For you history buffs out there , the headline	story
tale/n/wlp_ca_g02/8784180	is clearly stated as a dubious tale , if not indeed a subterfuge : <p> While all of you in the city are brothers , we will say in our	tale	, yet God in fashioning those of you who are fitted to hold rule mingled gold in their generation , for which reason they are the most precious - but	tale
story/n/wlp_ca_g01/17162474	in stand-up and improvisational comedy including Adam Carolla , Nick Swardson , Patton Oswalt , Brian Posehn , Thomas Lennon , Mary Lynn Rajskub and Eugene Mirman - will share	stories	and talk about what 's going on in the world and Benson will chime in whenever he darn well pleases . <p> Leonard and Sheldon are brilliant theoretical physicists ,	story
story/n/wlp_ca_g05/10749618	many sailors reported the incident , lending credence to the story of demons . <p> The ' Loving ' Uncle <p> Of course , the only real demon in this	story	was the ' loving uncle ' who never so much as @ @ @ @ @ @ @ @ @ @ , would survive for two and half years ,	story
story/n/wlp_ca_g01/1595325	pleasing to the eye by the variety of their colours . <p> Aladdin put them behind one of the cushions of the sofa he sat upon , and continued his	story	. When he came to the end , he said to his mother , ' I need say no more ; you know the rest . This is my adventure	story
story/n/wlp_ca_g03/14459395	they tell me not stop speak my own language , it 's like asking me to stop breathing the same air they are breathing \" . <p> I remember another	story	of an elder woman . When she was a little girl she also was caught speaking her language , and the teachers wanted to make an example of her to	story
story/n/wlp_ca_g04/18852973	few seconds , then smiles . These are n't big actions , but they 're all sufficient to set a tone that marks an endpoint for the passage . Each	story	can now go on with some new development , having described the basic setting to the reader 's satisfaction . <p> Since your VPC determines what you can say in	story
story/n/wlp_ca_g01/6450878	threshold . I 'm willing to sacrifice that tiny bit of a rustic nature for the pretty colours and the way it wears like iron . The Kureon 's another	story	. It softens some too , but always feels @ @ @ @ @ @ @ @ @ @ 's the nature of the beast . <p> Alia : Would	story
tale/n/wlp_ca_g03/1488669	, as if an anti-Symbolic tale must become an Imaginary one in which one narrator identifies with another , who introduces yet a third , in an endless regress of	tale	within tale , mirror within mirror . I have no space to repeat here what critics have already discussed : the many resemblances between the narrators Mary Shelley and Margaret	tale
story/n/wlp_ca_g05/15996645	are intelligence , loyalty and a sweet temperament . <p> The Newfoundland Dog is as much at home in the water as on dry land . Canine literature gives us	stories	of brave Newfoundlands which have rescued men and women from watery graves ; stories of shipwrecks made less terrible by dogs that carried life lines to stricken vessels ; of	story
story/n/wlp_ca_g03/16010667	today , I 'm going to try to let one go that I 've been clinging to for a long time . <p> I want to tell you about a	story	of betrayal from my grade 9 year . For those of you that are counting , this puts us in 1999 . So it 's the end of the millenium	story
story/n/wlp_ca_g03/8490493	a tough time choosing the winners , \" said Paul Shay , National Executive Director of The Kidney Foundation of Canada . \" We hope that people who read these	stories	will be inspired and find the strength needed to cope with the challenges of living with kidney disease . " <p> Most people have never heard of kidney disease until	story
