id	left	target	right	lemma
junkie/n/wlp_jm_b01/392846	suppose ! Certainly , without these inventions I would have suffered Alzheimers altogether and my hearing would be long gone . But here I am -- a living 100 heath	junkie	! Old age truly is not what it used to be . Nonetheless , I am not going out today -- The Ozone Index is too high -- it is	junkie
junkie/n/wlp_jm_b01/6800368	Coast \" , feel free to send me a message using my account name \" Infidel.8536 \" or tweet me @Geezam . <h> About Kelroy <p> Kelroy is an internet	junkie	, technology advocate , avid gamer and Japan enthusiast who envisioned Geezam.com as a Caribbean based technology blog that offered a more international view of ##3677551 <h> Meet the Battery-free	junkie
addict/n/wlp_jm_b01/1259585	matter how much we explain this to an addict or how much they see the effects that drugs have on the physique , state of mind or family , the	addict	is the one to desire change . @ @ @ @ @ @ @ @ @ @ feature of the moral model ) or else even though they are equipped	addict
addict/n/wlp_jm_b01/5791031	's a very interesting idea and I 'm sure it will be appreciated by one and all , \" said Chopra . Kapoor added , ? I am a coffee	addict	and this is a great opportunity to endorse something from the heart . I love the taste and aroma that Bru products offer . I am excited about this association	addict
addict/n/wlp_jm_b01/3182682	the pew or laughing while the soloist was singing . @ @ @ @ @ @ @ @ @ @ was that of Samuels , who was a homeless drug	addict	and rumoured prostitute ( She was stabbed to death on October 4 ) . " A same suh she gwaan , " one person said . " When she see	addict
addict/n/wlp_jm_b01/5286221	final step son footsteps . With the arrest of the 53-year-old woman , a drug trafficking activities in Wuhan <p> It is understood , was arrested 17 people all drug	addicts	are people in Hubei Wuhan people , of whom 15 . Was arrested 17 people , eight people have been arrested , remaining staff XingJu , air jordan pas cher	addict
addict/n/wlp_jm_b01/12023157	@ @ @ @ @ @ @ with his compulsive drinking mates . The vice should be permanent with time and funds if the dependency keeps growing further which the	addict	most of the time does n't mind as a result of nature of the compulsion . <p> These signs and symptoms are frequent symptoms of a flourishing horror going to	addict
addict/n/wlp_jm_b01/2541286	with white wine , \" says Pierre . We nod in agreement . We 're already hungry , but there 's something more pressing to do . We 're vinyl	addicts	on the way to a record factory . <p> Ameise Records , which describes itself as the smallest pressing plant in the world , is in Blankensee , ten kilometers	addict
addict/n/wlp_jm_b01/482497	is a word that comes and go , but few people really knows what it means to really love somebody , much less them self . Many people are relationship	addicts	. If they are not in a relationship , they do n't feel good about them self . Relationship junkies are expecting to find in someone else what is already	addict
addict/n/wlp_jm_b01/10063804	hand the individuals that can prepare a meal , to satisfy or tantalize @ @ @ @ @ @ @ @ @ @ end , and feeling like an food	addict	. <p> I am the master chef in my household . My husband hates the kitchen . He exerts absolutely no love or energy whatsoever , into his dishes .	addict
addict/n/wlp_jm_b01/1600001	Mix cds Saxon dropped got a fire around here but the ladies who hear it No stop request a copy ............ we in the LAND of the ADDICTS ... DUBPLATE	ADDICTS	.............. <p> festivals r different ther are all kinds of people there so u shouldnt really b looking for a sound to play dubs still <p> so sounds only have	addict
addict/n/wlp_jm_b01/4526233	honesty and talent you possess . It makes you indulge in @ @ @ @ @ @ @ @ @ @ AIDS patients who I personally know are well-known drug	addicts	. If you did n't know , let me tell you now . Many coke heads do not want to be known even though some can not be disguised because	addict
junkie/n/wlp_jm_b01/6788826	of the deals lie . So next time do some digging and not be \" surprised \" like PC World was . <h> About Kelroy <p> Kelroy is an internet	junkie	, technology advocate , avid gamer and Japan enthusiast who envisioned Geezam.com as a Caribbean based technology blog that offered a more international view of technology topics . Follow his	junkie
addict/n/wlp_jm_b01/6262944	training was necessary to accomplish this . <p> Outlining the benefits of the DTCs , Chief Justice Zaila McCalla asserted that they did not only provide a second chance for	addicts	who were determined to change their lifestyle but also served to assist in the fight to reduce crime and violence and to reduce the backlog of cases in the courts	addict
junkie/n/wlp_jm_b01/11634637	@ @ @ @ @ @ @ @ by all known by few , The one always apart in company yet never alone in solitude . A self proclaimed tech	junkie	and gadget connoisseur , he is a webmaster by profession , ##3816989 <h> Piracy and E-Books in a Tale of Two Cities <p> Not long ago , book sales were	junkie
addict/n/wlp_jm_b01/4678816	it ; she peddled a litde crack . She did whatever it took to keep Terrence fed , in decent clothes , and in school . But she was an	addict	, and could n't kick the crack . She became pregnant , and when the child was born the city took it immediately . It was a crack baby .	addict
addict/n/wlp_jm_b01/6365056	feel that it is the smartphone that has lured their children into this compulsion of usage . Whereas it is the lack of awareness and understanding that makes children mobile	addicts	. <p> Parents must educate their children and make them aware of a right usage of smartphone and about the peril of over usage of it . There are few	addict
addict/n/wlp_jm_b01/950550	He stated that the addict moves through a four-stage process , with each step becoming more addictive . <p> Preoccupation is the first stage in Carnes ' model . The	addict	is unable to think about anything else except sex . The addict begins to seek experiences to satisfy their desires . Ritualization is the second stage , in which the	addict
addict/n/wlp_jm_b01/12022850	could be hidden by the alcoholic or if not he 'll reason it out for something else . <p> The idea of early treatment is a good chance for the	addict	himself and his family to recover from the awful effects of the drug . We 're mindful that there are people who are struggling all their lives only to be	addict
junkie/n/wlp_jm_b01/6836719	out the Official Rift website at www.riftgame.com/en/ . Also check out the Rift 's Facebook Page and follow Rift on Twitter . <h> About Kelroy <p> Kelroy is an internet	junkie	, technology advocate , avid gamer and Japan enthusiast who envisioned Geezam.com as a Caribbean based technology blog that offered a more international view of ##3677585 <h> RIM Playbook Launch	junkie
addict/n/wlp_jm_b01/10603249	@ Her mother now a christian says she did not know , and my friend says she wants her to admit it , she is also now become a drug	addict	. <p> I am an only child that was referred to as handbag I was never sent to sleep overs or left in others care . When I hear these	addict
junkie/n/wlp_jm_b01/482517	, much less them self . Many people are relationship addicts . If they are not in a relationship , they do n't feel good about them self . Relationship	junkies	are expecting to find in someone else what is already within . <p> I have consciously stayed out of a committed relationship for over 5 years after my marriage ended	junkie
junkie/n/wlp_jm_b01/589869	. <p> CTO and co-founder of Sitemasher.com , a website development software-as-a-service company and serial entrepreneur . Addicted to kiteboarding . Loves to Mountain Bike and Ski .. General adrenaline	junkie	. ( Check out his video -- top to bottom run in the Whistler Bike Park with a camera attached to his chest : http : //www.youtube.com/watch ? v=n7RHjSDtv ...	junkie
junkie/n/wlp_jm_b01/6803046	me when I say that Google+ is the future -- it will just a while for the masses to **29;4302;TOOLONG it . <h> About Kelroy <p> Kelroy is an internet	junkie	, technology advocate , avid gamer and Japan enthusiast who envisioned Geezam.com as a Caribbean based technology blog that offered a more international view of technology topics . Follow his	junkie
addict/n/wlp_jm_b01/1599792	Mix cds Saxon dropped got a fire around here but the ladies who hear it No stop request a copy ............ we in the LAND of the ADDICTS ... DUBPLATE	ADDICTS	.............. <p> sice like 2002 i saw saxon for about 5 times in my hometown and a bere 45s dem a play allt he time ... inb 2k6 i was	addict
addict/n/wlp_jm_g01/14194493	terminally ill entity that is ravished by years and years of abuse , mistreatment and corruption . The slow , steady , inevitable decline and ultimate demise of a drug	addict	presents an interesting analogy of reggae 's untimely demise . <p> Undoubtedly , reggae 's fore fathers and pioneers are in awe as to the current plight of music that	addict
addict/n/wlp_jm_g02/1600016	TURMOIL BEGINS in NEW YORK ....... ADDICTS UNITE .... <p> As this Thanks GivING week begins in NEW YORK US OUTSIDER need fi UNDERSTAND some of the PRESSURES our FELLOW	ADDICTS	a go EXPERIENCE this coming weeek ........ NOW from what me understand about the YANKS .... thanks giving is a BIG RASS FAMILY OCCASION ..... and YOU HAVE THREE BIG	addict
addict/n/wlp_jm_g01/8658808	@ @ customers of \" heavy drugs . \" Among the most popular is the psychological craving for the controlled substance when not working with it . <p> The marijuana	addict	is haunted by continuous thoughts of tips on how to find far more weed . This craving causes the addict to disregard legal constraints or even his own individual safety	addict
addict/n/wlp_jm_g01/76033	, Go , but still need a little help making your travel dreams come true ? Ask your travel questions below and sign up for ##1346946 <h> The First Travel	Addict	Meet Up -- Atlanta <p> Last Thursday , I hosted the first Travel Addict Meet Up in Atlanta , GA at YEBO , a new South African restaurant and bar	addict
addict/n/wlp_jm_g02/8338888	@ @ @ @ Evo Morales , leader of the Federation of Coca Growers in Bolivia . ( Before he was president ) <p> \" There are no cocalero drug	addicts	. It 's the " gringos " who have processed the coca leaves with chemical products as a drug . We do n't do that because we want to sell	addict
addict/n/wlp_jm_g01/8636855	be A Self Aid Project <p> In regards to marijuana dependency , the addict 's challenge is everyone 's problem . It requirements to be taken seriously . Ignoring the	addict	wo n't make the issue go away . Experienced intervention will be the only technique to aid the marijuana addict inside the long-term . <p> Fortunately , therapy for marijuana	addict
addict/n/wlp_jm_g02/12617528	guess that 's when I decided to fail . I knew enough about heroin to know that it was certain failure--that if anything would insure failure , becoming a heroin	addict	would be it . I had full knowledge . " <p> On April 2 , 1985 ( Morgan remembers the dates of each entry and release ) , he finished	addict
addict/n/wlp_jm_g02/24182	always in search of the best cupcake a city has to offer ! <p> To all my cupcake lovers out there , I present to you , the Absolute Travel	Addict	's Cupcake World Tour : The Search for the BEST cupcake in the world . This page will highlight links , reviews and information about some of my ( and	addict
junkie/n/wlp_jm_g01/411613	, much less them self . Many people are relationship addicts . If they are not in a relationship , they do n't feel good about them self . Relationship	junkies	are expecting to find in someone else what is already within . <p> I have consciously stayed out of a committed relationship for over 5 years after my marriage ended	junkie
addict/n/wlp_jm_g02/15243981	substances -- such as heroin -- in a safe environment where they are monitored by the staff to prevent them overdosing . <p> Here at the centre the 1,000 drug	addicts	who utilise its services daily , are never short of what the staff refers to as harm-reduction supplies as they are issued a steady diet of condoms , lubricants ,	addict
addict/n/wlp_jm_g01/411593	is a word that comes and go , but few people really knows what it means to really love somebody , much less them self . Many people are relationship	addicts	. If they are not in a relationship , they do n't feel good about them self . Relationship junkies are expecting to find in someone else what is already	addict
addict/n/wlp_jm_g01/8636875	. It requirements to be taken seriously . Ignoring the addict wo n't make the issue go away . Experienced intervention will be the only technique to aid the marijuana	addict	inside the long-term . <p> Fortunately , therapy for marijuana addiction is practically generally effective so long as the patient , loved ones and good friends are all willing to	addict
addict/n/wlp_jm_g02/1864394	the radio and told him he needed 20+ seconds to ensure he keeps the lead after making his pit-stop . And what did M Schumacher do ? Drive like an	addict	in search of a fix ! Suffice it to say , he delivered what was asked and the rest is a chapter in @ @ @ @ @ @ @	addict
junkie/n/wlp_jm_g02/5792847	entities carrying them at all . Then you really will be talking to yourselves . <h> Post navigation <p> #3 is especially important , DJ . I 'm a political	junkie	and I struggle to listen to their presentations . They are conceptually flawed , structurally weak @ @ @ @ @ @ @ @ @ @ coaches and writers .	junkie
addict/n/wlp_jm_g02/11785321	what healthcare ? The time is coming soon , I can feel it : when the world will begin to realize that smoking pot will not make you a heroin	addict	, it will not detriment your health , and that you are not supporting criminal activities . <p> The East Indians have known its power before there was even people	addict
junkie/n/wlp_jm_g02/10079400	n't ! Eating healthy combined with exercise is the only way to do it . So save your money on the quick fixes . <p> I am not a workout	junkie	or body builder . I am a regular girl who enjoys working out , eating healthy , and staying in shape . I am just like you . <p> Here	junkie
addict/n/wlp_jm_g02/13680900	. <p> Mr. Chairman , CARICOM Governments , like others , have been forced to commit significant portions of scarce human and financial resources to the treatment and rehabilitation of	addicts	as well as on law enforcement , often to the detriment of other sectors such as social development . Our Governments are also forced to assign even more resources to	addict
addict/n/wlp_jm_g01/5887601	instantly ! /buttonlink clear /onethirdlast <p> Prohibition of smoking in pubs and restaurants appears to have encouraged people to try to cut downFive years after the smoking ban drove nicotine	addicts	out of pubs and into huddles on the pavements ##1362343 <h> Learning How To Focus , Even When It Is Not Easy <p> A lot of people pick their way	addict
junkie/n/wlp_jm_g02/1993660	bounce around the bamboo forrest . <p> Handmade rafts : <p> Souvenir handmade rafts : <p> Light fantastic : <p> Note : This is not a trip for the adrenalin	junkies	@ @ @ @ @ @ @ @ @ @ some downtime ... <p> ... or a complimentary glass of refreshing rum punch ! For reservations ... Tel : (	junkie
addict/n/wlp_jm_g02/5727102	to explain Negril to someone who 's never been there . You have to experience it for yourself . I do n't think it 's for everyone , but us	addicts	just ca n't get enough . : ) <p> suzengrace <p> 01-27-2012 , 02:16 PM <p> Welcome ... Glad your not longer lurking .. The more merrier ... <p> marley9808	addict
addict/n/wlp_jm_g01/2844444	@ @ @ @ @ @ @ @ @ own shop in the heart of Ocho Rios , but this brought him into direct contact with some of the cocaine	addicts	frequenting the area began to make his life miserable . Things came to a head when they engaged in subtle attempts at exhortation . <p> After all the years of	addict
addict/n/wlp_jm_g02/14690911	meant for him . <p> His mind drifted to a time when he was much younger . <p> His father sold crack on the corner and his mother , an	addict	, offered sex for drugs when money was lacking . <p> She came to his father one night as usual offering herself so she could feed her need . It	addict
addict/n/wlp_jm_g02/5731154	is the Seafood Bar and Grill ? ? ? ? I generally stay pon da cliffs anymore , so help me out on this one . Being a major seafood	addict	@ @ @ @ @ @ @ @ @ @ <p> Presleys across from rockhouse great time <p> yetta <p> 03-06-2012 , 01:29 PM <p> Thanks vikman ! ! I	addict
junkie/n/wlp_jm_g01/6891368	I am living the life I have always dreamed of living . My life just happens to revolve around Planet Business . I am an entrepreneurial addict , a business	junkie	. Business is my chocolate , my Krispy Kreme donut , my nicotine , my caffeine , my crack . Maybe I 'll start a 12 step program for entrepreneurs	junkie
junkie/n/wlp_jm_g02/243034	to stash away her \" must haves \" and \" just in case I need items @ @ @ @ @ @ @ @ @ @ for the social media	junkie	, and of course tissues for an unexpected tearful moment . One of the best things about pockets is it does not compromise the design of the gown . Putting	junkie
addict/n/wlp_ie_b01/3285217	program . <p> \" I am reviewing the conditions under which this can be implemented , \" she added , saying that the issue of providing safe premises for drug	addicts	should not be exploited by rivalling political groups . <p> But France 's conservative opposition UMP party has said it was against such a test run . <p> " Opening	addict
junkie/n/wlp_ie_b01/19321532	video have now been disabled but a quick look at the associated Beaut.ie post @ @ @ @ @ @ @ @ @ @ Benefit is , as all beauty	junkies	know , ' Laughter is the best cosmetic ... so grin and wear it ! ' but I 'm just finding it very hard at the moment to find these	junkie
addict/n/wlp_ie_b01/15104860	drug-related crime and for the debate to be opened on the decriminalisation of drugs . <p> The motion from the technical group also called for more residential rehabilitation places for	addicts	@ @ @ @ @ @ @ @ @ @ people were being left on it far too long , because " it 's much cheaper to have someone on	addict
addict/n/wlp_ie_b01/14376331	in here a out ' problems ' in South Dublin with valuing money . If I made the same sweeping generalizations about Ballymun or Sheriff Street being infested with drug	addicts	the same people would be in uproar . Chips on their shoulder ... <p> And the ironic thing is we are talking about this shite of where they went to	addict
junkie/n/wlp_ie_b01/6614576	Tuesday , September 4 , 2012 <h> Image Skincare - Review <p> Morning all ! Now as some of you may know , I 'm a bit of a product	junkie	. Well , I 'm actually a massive product junkie ! One of the areas of products I find myself delving into constantly , is skincare . I 'm obsessed	junkie
addict/n/wlp_ie_b01/6432628	easy to blame both the weather and the still-novel immediacy of internet-instigated information sharing for this Autumn malaise . In reality , we 're all just impatient . <p> Fashion	addicts	have already seen the September issue covers , the high-street lookbooks , the catwalk shows in London and Milan . Now we just have to wait for the items to	addict
addict/n/wlp_ie_b01/7192699	when he wanted something , whether to announce or to confide , he made his bonding with Dermot . Dermot , the scientist , the proud son , the drug	addict	-- pick the odd one out . Oh yes , Father did not know . In a moment of pique @ @ @ @ @ @ @ @ @ @	addict
addict/n/wlp_ie_b01/18724541	carrying , and using such weapons , and the devastation they can cause . <p> This series includes unique perspectives from the perpetrators of knife crime , including former drug	addict	' Tracey ' , who carries a sharpened blade in her handbag . She 's told 98FM , " I was n't brought up to carry a knife , but	addict
addict/n/wlp_ie_b01/13183706	helps out with the raring of the baby . MTV are like ' Oh girl , you got preggers and now you 're all alone and you 're a drug	addict	AND YOU 'VE NO MONEY AND YOUR BABY DADDY IS OUT DRINKING ... now let us film it and @ @ @ @ @ @ @ @ @ @ Shore	addict
junkie/n/wlp_ie_b01/9863141	lots of us around . Im a little disappointed in this new discovery because I really wanted to be different but looking at the bright side , being a tech	junkie	has helped me to truly appreciate everything the outdoors has to offer . Let me try to explain . While hunting elk in Arizona a few years ago , I	junkie
junkie/n/wlp_ie_b01/16333206	central characters . <p> A naturalistic drama , it 's dry Irish sarcastic humour is slightly stereotypical , borderline clich but well conveyed none the less ; from the typical	junkie	to our nameless busker just looking @ @ @ @ @ @ @ @ @ @ known only as guy ( Glen Hansard ) and girl ( Markta Irglov )	junkie
addict/n/wlp_ie_b01/13719026	people who pay tax , and struggle to meet their mortgage and childcare costs , should have their money confiscated from them through taxation and given to criminals and drug	addicts	as dole payments , housing allowance , free or subsidised housing etc . <p> Bleeding heart fools like Vincent Browne are totally out of date . <p> Agreed 100% .	addict
addict/n/wlp_ie_b01/850012	of time . <p> Thousands of miles away from her hometown in the Bay Area , California , Chelsea is a traveler , reader , animal lover , and sweets	addict	( candy corn being top on the list ) . A firm believer in the expression @ ##3756834 <h> British Travel Trends -- Christmas Holidays 2012 <p> Though the Christmas	addict
addict/n/wlp_ie_b01/7223270	Jack . Yes , I know he 's not a great catch . He 's kind of funny looking and wears a weird wool suit . He is a laudanum	addict	and a man who loves nothing more than prescribing a slime draught or a yummy purgative , just to teach you a lesson about drinking . He 's also not	addict
addict/n/wlp_ie_b01/6432691	@ @ @ @ @ @ @ @ . It 's not unlike an actual addiction , but with much less significant withdrawal symptoms . Whoever heard of a crack	addict	dying of boredom ? <p> In fashion , unlike life , the fun in getting something is n't in the anticipation . It 's in the the tactile sensations of	addict
junkie/n/wlp_ie_b01/6614586	Review <p> Morning all ! Now as some of you may know , I 'm a bit of a product junkie . Well , I 'm actually a massive product	junkie	! One of the areas of products I find myself delving into constantly , is skincare . I 'm obsessed with it . I 'm obsessed with going on the	junkie
addict/n/wlp_ie_b01/720514	wear moisturizer every day @ @ @ @ @ @ @ @ @ @ , and this does the trick beautifully . I ##3756563 <p> Last Friday night , telly	addicts	and Chris O'Dowd enthusiasts sat down to watch the first two episodes of Moone Boy , the eagerly anticipated new series written by O'Dowd for Sky . A new Irish	addict
addict/n/wlp_ie_b01/8930863	human beings are treated in detention . They usually belong to the most disadvantaged , discriminated and vulnerable groups in society , such as the poor , minorities , drug	addicts	or aliens . Within detention facilities there is usually a strict hierarchy , and those at the bottom of the hierarchy , such as children , the elderly , persons	addict
junkie/n/wlp_ie_b01/3141644	alphabetising is neglected . And it 's tiny . Tiny tiny . <p> I feel a bit sad for your gym people who have to work . Unless they are	junkies	like yourself , of course ! <p> By the way , if I 've never extended it before -- if you want to visit Ireland I 'm offering our spare	junkie
addict/n/wlp_ie_b01/4422084	a game-changer for fiscal policy terms . Federal cigarette taxes bring in about $10 billion a year . Even heavy pot smokers do n't smoke nearly as much as cigarette	addicts	, so even at triple taxation we 're talking about low single-digit billions in revenue -- not nothing , but hardly transformative to the overall budget . <p> Still the	addict
addict/n/wlp_ie_b01/18802233	see \" begins to make perfect sense . <p> The lost sheep morphs into a starving child , a homeless veteran , mentally ill old woman , a grieving drug	addict	, or a forgotten inmate . We are One and we feel this in our soul . It is not scary , it is a delicious and powerful revelation .	addict
addict/n/wlp_ie_b01/18262513	example , is an earbashing for our grades . I got 83% and @ @ @ @ @ @ @ @ @ @ but I 'm a weird freakish A1	addict	who hates 89% . She 's meant to give me a cookie and tell me well done . But getting back to the point , no actual Biology has been	addict
addict/n/wlp_ie_b01/241682	who was one of the first to come out in the hard rock scene , a class clown with a great sense of humour and deadpan delivery , and an	addict	who struggled with drugs and alcohol ever since she took her first drink as a child . <p> Most of the footage is home video @ @ @ @ @	addict
addict/n/wlp_ie_b01/22248434	Re : What 's \" The Most Important Thing ? \" <p> \" I think we are like drug addicts \" <p> We are , Iris . We 're craic	addicts	. <p> I find that that high can often be difficult to reach in a regular session , playing in the same place , with the same people every week	addict
junkie/n/wlp_ie_b01/19741077	workshops on the business value proposition , market research and validation , sales training and financial management . The deadline is 4 January 2013 . <p> Anne Tuohy , Room	Junkie	, which offers on line advice on home interiors , is currently a participant says , " New Frontiers has been very valuable to me in developing and testing my	junkie
junkie/n/wlp_ie_g02/13703063	@ @ @ @ @ @ cold , the rain and the dark when others were home asleep in their warm beds . They were vulnerable to the drunks ,	junkies	, thieves and crazies on the city streets when others were secure in their homes . They were up all night on security duty while others arrived after a good	junkie
