id	left	target	right	lemma
addict/n/wlp_ie_g03/10439487	the important issue of identity , in relation to recovered/recovering drug users . <p> In Sarajevo , Bosnia and Herzegovina from 30.03.2012 to 01.04.2012. the 6th international conference of recovered	addicts	took place . The organizer of this traditional event is Association for the Resocialization of former addicts " Proslavi Oporavak -- Celebrate Recovery " , which is an EURAD affiliate	addict
addict/n/wlp_ie_g02/12062402	over by that glorious smile . I was so proud when he won the Bonny Baby competition two years running . <p> Thirty years on , Paul is a heroin	addict	-- and the smile is n't there @ @ @ @ @ @ @ @ @ @ me start at the beginning ... <p> I met my husband when I	addict
addict/n/wlp_ie_g02/4149581	what I think the truth is : We are all addicts of fossil fuels in a state of denial , about to face cold turkey . And like so many	addicts	about to face cold turkey , our leaders are now committing violent crimes to get what little is left of what we 're hooked on . <p> With Gore 's	addict
addict/n/wlp_ie_g02/5429823	<h> Main menu <h> Monthly Archives : November 2011 <h> Post navigation <p> The essay is submitted . And the cold is fast abating ( thank you , crystal meth	addicts	, for not yet existing in such numbers here as to lead to the banning of pseudoephedrine , my best friend in times of congestion-related crisis ) . So I	addict
addict/n/wlp_ie_g03/20949088	you 'll find , a lot of the people who are \" screwing the system \" are well practiced in how not to get booted off the dole . Alcoholics/drug	addicts	who know they just have to turn up to their medical assesment drunk to get another year or two on their book , no questions asked . The people genuinely	addict
addict/n/wlp_ie_g04/752960	reserved seating in the front row . <p> Have all C.A. literature available . <p> Remember our @ @ @ @ @ @ @ @ @ @ and Touch Deaf	Addicts	<p> Send all current C.A. literature to schools for the deaf , social agencies that help this community ( via Public Information and Hospitals &; Institutions Committees ) , and	addict
addict/n/wlp_ie_g04/20188976	know this guy with the fiddle from the first youtube clip . He is from the town of Voronezh and is quite a beginner , though he 's a great	addict	of Irish fiddling . I have not heard of him for long time . The problem is that he is there alone in his town and does n't to play	addict
addict/n/wlp_ie_g04/13532461	the highest in the EU while deaths of people on methadone programmes increasing . In the first of a two-part series on Ireland 's heroin problem , we ask how	addicts	are being treated here , writes BRIAN O'CONNELL <p> ACCORDING TO data released at the end of last year , Ireland is top of the table of EU countries when	addict
junkie/n/wlp_ie_g01/10707973	@ @ @ @ @ @ @ been managed non-intensively and protected by local peoples for generations . The land is only empty in the greed-blinded eyes of the money	junkies	. Local people are able to see the local eco-system , its flora and fauna , and make a life from places that they also see as their home .	junkie
addict/n/wlp_ie_g04/12794899	with Martin Sheen in Stella Days . But her most chilling role to date must surely be her IFTA winning performance in Rewind , where she plays a recovering drug	addict	mum , whose past @ @ @ @ @ @ @ @ @ @ to date ? <p> " It was certainly different ! It was shot in 19 days	addict
addict/n/wlp_ie_g03/19689572	s working . It ? s one of the very few projects that is working . We take people of all ages . We take drug addicts and non drug	addicts	, etc . The only criteria is you have to be an ex-prisoner , you have to have gone through the criminal justice system . It ? s not a	addict
addict/n/wlp_ie_g03/7629297	stigma of addiction . Accountability must be tempered with compassion . <p> People still see addiction as a personal weakness . When stigmatizing addicts , people often perceive that the	addict	should have risen above weakness , that he or she could have chosen otherwise at the time addiction told hold . <p> Think of the people you know . Think	addict
addict/n/wlp_ie_g01/12119345	sample and I 'd go in and put tea in the bottle and make it look like urine and put some methadone into it ... the things that a drug	addict	is going to think up to do . <p> " Their brains are great when it comes to doing things like that , but anything else ... do n't go	addict
junkie/n/wlp_ie_g03/15906034	any more .. your turqoise and white ones are gorgeous tho ! ! ##1681560 <h> Pages <h> Monday , March 12 , 2012 <h> You know you 're a beauty	junkie	when ... <p> In my recent ombre nail post , I spoke about my pals that are n't beauty junkies not getting why I would want to paint each nail	junkie
addict/n/wlp_ie_g01/1720410	the litany of compromises and tough choices he had to make ( as well as a few that were made without him ) during the distribution and marketing of Sex	Addict	, as well as hilarious , if sometimes petulant , rebuttals of negative reviews the film receives . Zahedi even occasionally goes completely off-topic , posting short videos of recent	addict
addict/n/wlp_ie_g03/4728165	I think perhaps what you mean is you do n't want it on the front burner anymore . For me , being clean is a gift , and being an	addict	means I have to have that close relationship to God that I 've always wanted . So addiction can be a gift . Perhaps it is the same for you	addict
addict/n/wlp_ie_g01/16289045	85 I feel fulfilled . My life has been very varied . I worked as a second level teacher , a careers ' counsellor , and addiction counsellor with drug	addicts	and a chaplain to young offenders . These were my professional duties , and they were carried out in various countries . However , they do not describe my life	addict
junkie/n/wlp_ie_g01/19404907	. When you hear this word , what comes to mind ? Junkies living in cardboard boxes on the city streets ? Cardboard city , lazy bums , drunks ,	junkies	, scroungers , desperate , alone , stupid , mad ? <p> Do you imagine people begging with a McDonalds ' paper cup for a little money to get a	junkie
addict/n/wlp_ie_g04/752532	achieve the same freedom . \" C.A. 's 12th Step tells us that we , as a Fellowship , have a responsibility to reach out to carry this message to	addicts	. The 1st and 5th Traditions remind us that " our common @ @ @ @ @ @ @ @ @ @ unity " and that " each group has	addict
addict/n/wlp_ie_g03/516604	additional cost . <p> Thousands of miles away from her hometown in the Bay Area , California , Chelsea is a traveler , reader , animal lover , and sweets	addict	( candy corn being top on the list ) . A firm believer in the expression " ##1603962 <h> NH Hoteles collect corks as part of new agreement on the	addict
junkie/n/wlp_ie_g02/13379257	@ @ @ @ @ @ @ I am taking better care of my teeth than ever they have reverted to a horrible yellow colour ( I look like a	junkie	and I do n't even smoke ! ! ! ) and an upper right has literally crumbled away ! Someone recently mailed me with info on a dentist in Ballsbridge	junkie
addict/n/wlp_ie_g03/1279188	previous novels . To a large extent , Hole is a conventional protagonist in the police procedural sub-genre : a loner , a rebel against the system , a hard-drinking	addict	to justice for its own sake , a man wounded by life and carrying a torch for a lost love , a man not noticeably handsome yet irresistible to women	addict
addict/n/wlp_ie_g03/10461476	it is an imperative to protect their citizens from this threat . They also stress that drug addicts must be taken care of and that access to care for drug	addicts	should be a human right . They also highlight the importance of fighting against overdoses and HIV . <p> Germany ( Plenary Day Two ) <p> Germany highlights the challenge	addict
addict/n/wlp_ie_g01/10020745	work , has an added cross to bear : the film details his long battle with a sex addiction to prostitutes . That the naturally titled I Am a Sex	Addict	( 2005 ) also manages to be his most accessible , funny and ( believe it or not ) heartwarming film to date -- and his first to be screened	addict
