id	left	target	right	lemma
site/n/wlp_gb_b01/20547584	. We feel that in the spirit of the project this would not be beneficial to a frank and open discussion . <h> Disclaimer <p> The views expressed on this	site	are entirely of the individual concerned and in no way are those of any other ##3720614 <h> London Fields Brewery Day ( Piss-up in a brewery ) <p> On Saturday	site
site/n/wlp_gb_b04/5330678	. <p> We also have concerns that an increase in capacity for day case surgery could be used as a means of reducing the current waiting lists at other CMFT	sites	. With an estimated 1,500 people on the waiting list at CMFT this could increase , rather than reduce waiting times for Trafford residents . <p> How this is managed	site
site/n/wlp_gb_b03/5900013	you think is wonderful and then put or add them in your website . Let 's acquaint ourselves with a few cons of Professional Website : <p> Building an internet	site	or even educate yourself on the principles about Professional Website will certainly test out your endurance . Of course , not necessarily every little thing happens instantaneously or in simple	site
site/n/wlp_gb_b06/13416558	not always give their full catalogue to the aggregators , may embargo their information for weeks or months , and may have more up to date information on their web	site	. You can also sometimes get a better deal by going direct to the publisher . <p> Dates . Compared with structured databases , proper and accurate date searching is	site
site/n/wlp_gb_b05/14582168	readers feel sorry for you . This is a relationship of equals , it 's a partnership , unless you are prepared to bail out every single reader of your	site	, keep your desperation to yourself . <h> The Passive Approach <p> With the passive approach , bloggers do n't even try to sell anything at first , they are	site
site/n/wlp_gb_b02/8324589	is usually the best architecture if you need to host dozens of small microsites or if you have one website differing across multiple markets . In most cases , your	sites	share common layouts and templates and you do your best to separate the actual content . <p> How do you enforce this on editors ? You must narrow down the	site
website/n/wlp_gb_b06/2586892	people are simply put off of any mention of \" forum \" entirely ; perhaps a rename is necessary ? ) <h> : : Competition Idea #1 : Design a	website	for NNF <p> The task would be to design a web page to advertise / provide download of NNF . The requirements would be that it must work with GitHub	website
site/n/wlp_gb_b02/6589152	something to think about if you felt comfortable doing this , <p> Please do n't feel that you have nowhere to turn , there is always someone here at The	Site	do please always ##3056415 <h> Sunday , 11 November 2012 <h> The story of " The Unknown Soldier " <p> On September 7th 1920 , in strictest secrecy four unidentified	site
website/n/wlp_gb_b05/16696469	Trillionaire and you wo n't miss the money make them an offer they ca n't refuse then do what you like . <h> 67 . Create viral videos for your	website	<p> Viral content rocks full stop . <h> 68 . Create give aways for your site <p> People love winning free stuff , a simple example of how you could	website
website/n/wlp_gb_b07/19343986	so do n't ever worry about that . But if you like the show , why not support us with your money ? So we can pay for things like	website	hosting , upkeep and continuing to provide the full length lecture recordings and stuff you get on our Pod Delusion Extra feed ? <p> ? 5/month : ? 10/month :	website
site/n/wlp_gb_b03/6645653	and smart . That 's why I have decided to look where I can get them from . And I found them on the Get Ahead Of The Games web	site	. <p> Get your own copy of the Get Ahead of the Games posters . <p> By popular demand , you can now download all of the Get Ahead of	site
site/n/wlp_gb_b02/5552707	. Could you list all ? f your sh ? red sites li ? e your Facebook page , twitter feed , ? ? linkedin prof ? le ? my	site	: : payday loan <p> Fantast ? c site you hav ? here but I was wanting to know if you kn ? w of any mes ? age boards	site
site/n/wlp_gb_b03/7008722	Wastwater is an illusion : While the valley floor is at 200 feet above sea level , the real bottom of the valley is 250 feet farther below -- a	site	written into local folklore after divers created a gnome garden on the lake bed . <p> Now , because @ @ @ @ @ @ @ @ @ @ local	site
website/n/wlp_gb_b06/5600670	marketers are going to have no choice other 01224 443551 for a chat about your company 's on-line needs . <p> We 've been getting a lot of half baked	website	specifications recently . In essence some lazy ' management consultant ' has put together something based on their little knowledge ( is a dangerous thing ) leaving web devs like	website
site/n/wlp_gb_b05/2909719	: **26;28;TOOLONG to find the best advice on Getting a guy to like you for you . ... <p> ... to learn another 100 ways , then visit Daria 's	site	to learn How to Get A Guy To Like You , then visit @ @ @ @ @ @ @ @ @ @ a guy to like you for ...	site
site/n/wlp_gb_b06/18498286	to be true . Thanks for the article as it confirms that it is ! <p> Companies are happy to send samples for review assuming you have a good quality	site	that is already demonstrating appropriate review content . You can either approach companies directly or PR companies . Or wait and they 'll soon contact you once your site gets	site
site/n/wlp_gb_b02/13491715	experience , I just find ##3124016 <h> Honda Uses Pinterest to Drive More Interest <p> As Pinterest 's popularity grows and grows , so do brands ' involvement in the	site	. Car giant Honda has now decided to harness the power of Pinterest to drive interest for its website and the new Honda CR-V , with a campaign called Pintermission	site
website/n/wlp_gb_b02/5609580	the only private outdoor pursuits company to actually own the crags they use for courses , etc , etc . So what has this to do with the new ski	website	? - simple , it means that we are not very PC . Mountaineering in the last non PC industry left . It stems from the saying " you got	website
website/n/wlp_gb_b07/15849294	@ @ @ @ @ @ @ ago , while this year it recruited a Chinese-speaking employee to its UK office . <p> The WSET has also just launched its	website	in Chinese along with a page on China 's Facebook-equivalent , Sina Weibo . <p> Furthermore , it has introduced its Diploma progamme as a distance-learning course in Shanghai and	website
site/n/wlp_gb_b04/9570662	. We have a place where about 1,000 orphans are being cared for ; where they are fed and clothed and looked after . We have a school on that	site	, and are now building a big hospital for the use of the local people for free health care . A friend of mine , from Totnes , has invested	site
website/n/wlp_gb_b01/14125261	about getting a diverse set of @ @ @ @ @ @ @ @ @ @ Otherwise you run out of funders . \" <p> Peoplefund.it have teamed up with	website	energyshare.com who agreed to match any funds from other investors . 5,000 came from people 's pledges and another 5000 from energyshare.com . <p> Quiggin says it is a lot	website
website/n/wlp_gb_b04/6893468	@ @ @ @ @ crimes on headed paper for several years \" . That was written in 1992 . The equivalent today would be a court-ordered logo on the	website	or a mandatory hashtag like #convictedofmisselling . <p> Then there is a direct attack on the shareholders : " Instead of fining the company , a judge could order that	website
website/n/wlp_gb_b07/10021129	go to war , Christian Grey 's endless smirking , and the entire cast 's TERRIBLE taste in clothes , music and humour . <p> But this is a geek	website	. So I figured I should leave that stuff to others and simply @ @ @ @ @ @ @ @ @ @ a gadget virgin <p> Our hero ,	website
website/n/wlp_gb_b04/12065193	that accounts for 20 million hours per day in total . <p> A artistic presentation from Dan Lukas from Needle Insights then followed . Dan discussed the difference between commercial	websites	and free websites with the former operating a website purely for money and the latter doing it for the love . This division has long existed however it is starting	website
website/n/wlp_gb_b02/14372776	, SnowSports is one of the more challenging sports societies out there . With trips to the Alps and egular practice meetings showcasing this extreme ##3132518 <h> Custom essay writing	websites	: ever justified ? <p> Over the past few years , custom essay writing websites have become a hotly debated topic in the world of academia . There are now	website
website/n/wlp_gb_g10/19615910	Nancy Talbott 's and Robbert van den Broeke 's eyewitness account of three brilliant tubes of light creating a crop circle in Holland has just been posted on the BLT	web-site	and on YouTube . For full report &; video-clip see : http : **35;4962;TOOLONG ... . <p> It was in August 2010 that with the help of @ @ @	website
site/n/wlp_gb_g11/23043639	ACCEPTANCE OF THESE TERMS AND AGREE TO BE BOUND THEREBY . IF YOU DO NOT AGREE TO THE TERMS OF THIS AGREEMENT , YOU MAY NOT CONTINUE TO ACCESS THE	SITE	OR RECEIVE ANY SERVICES FROM ARKADIN . IF YOU DO NOT ACCEPT THESE TERMS , YOU MUST IMMEDIATELY CEASE USE AND/OR ACCESS TO THE SITE OR @ @ @ @	site
site/n/wlp_gb_g02/23655912	to the brim with delicious local produce that you could enjoy in the Yorkshire Dales National Park . All you have to do is fill in ##1487809 <h> Search the	site	<h> Tortoise ( Galapagos ) <p> Description : High convex shell and tough scales over legs . Feet are not webbed unlike turtles . <p> Size : Length - 1.5m	site
site/n/wlp_gb_g08/4214149	program with GNT Channel . I would like to give an opinion . Place a portuges version so that more people here in Brazil could access your site . Your	site	? Is also very good , but read the recipes in English is a little tricky . Thank you for your attention . Hugs from Brazil . <p> 7. by	site
site/n/wlp_gb_g11/17632557	greater than the limits accepted in California . These are toxic components found in crude oil and formation waters . <p> People here literally live on top of toxic waste	sites	. We visited a family whose house had been constructed next to an abandoned waste pit . After some 30 years , vegetation has grown over the @ @ @	site
website/n/wlp_gb_g01/21821658	break the design and feel of the site . The importance of good photography in web design is imperative . A wonderful shot highly related to the content of the	website	can help to bring a visitor in , and if there are great photographs which are prominent on each page , then this helps encourage the visitor to stay even	website
site/n/wlp_gb_g11/4149868	it could be used for something else , \" he added . <p> Sheerness West Cllr Steve Worrall said he is sceptical anything can be enforced to make sure the	site	is cleared . <p> " It may well be somebody 's responsibility , but that does n't mean it 's enforceable , @ @ @ @ @ @ @ @	site
site/n/wlp_gb_g03/4219044	la Reddition Musee de la Reddition is the site where Germany surrendered in World War II , making it one of the most important - yet relatively unknown - historic	sites	in France relating to this famous conflict . <p> Musee du Louvre One of the best places to visit in France for stunning exhbitis of art and history is Musee	site
website/n/wlp_gb_g04/4957912	was . <p> The Chartered Institute of Personnel and Development @ @ @ @ @ @ @ @ @ @ its members . You can find this on the CIPD	website	, together with a set of ' frequently asked questions ' that explains how to make a complaint against a member . <p> Unfortunately , not all HR managers are	website
website/n/wlp_gb_g10/1644196	the right to withdraw or amend the service we provide on the Website without notice ( see below ) . We will not be liable if for any reason the	Website	is unavailable at any time or for any period . <p> 2.2 From time to time , we may restrict access to some parts of the Website , or the	website
site/n/wlp_gb_g11/18886661	I suggest that you owe it to yourself to learn how online dating free site works but this is mainly due to the fear of damaging the online dating free	site	. <p> There are plenty of hard working teens out there who appreciate dating site in europe . Free dating sites collectors are an interesting group of mavericks . I	site
website/n/wlp_gb_g12/797540	one called Plants for Places . <p> How to find out what sort of soil you have in your garden All about soil from The Gardening Telegraph The BBC Gardening	website	has lists of plants suitable for each soil type @ @ @ @ @ @ @ @ @ @ , alkaline ) , with descriptions , photos and growing information	website
site/n/wlp_gb_g07/5622991	@ @ @ @ @ @ @ @ @ @ for approximately four months . <h> TfL 's online application form <p> Applicants need to register with TfL 's career	site	in order to submit their application . <p> Application form sections include : <p> Questions - preliminary questions about previous convictions , geographical flexibility , and any special requirements <p>	site
website/n/wlp_gb_g11/15145919	a special treat . It was an innocent time , gone for ever . ' <p> Aldershot housewife Jill Morgan spoke for the majority of contributors to a BBC history	website	in 2007 when she pleaded : ' Bring back the values of the Fifties ! ! ! ' <p> But the playwright David Hare , a man of the same	website
site/n/wlp_gb_g04/17140372	. Be prepared to work all hours . <p> 5 . Keep your blogs , websites etc updated . <p> 6 . Have a look at the revamped BBC jobs/career	site	www.bbc.co.uk/jobs/ <p> Think about who you want to speak to when you use social networks but do n't forget who might be listening . Do n't be afraid to experiment	site
site/n/wlp_gb_g08/12345644	to look at some pretty pictures perhaps ? If you want to do that you can see much prettier shots elsewhere . Surely the main advantage of posting on a	site	such as this is that you improve by getting decent feedback from a range of people . Not just ' clicks . <p> Started reading this thread and it was	site
website/n/wlp_gb_g10/2435046	@ @ @ @ @ @ . <p> Remember that most SEOs came from an IT background where they were tasked with the challenge of increasing search traffic once the	website	was built . So those IT consultants that rose to the challenge of SEO naturally started getting involved in marketing duties including web copy writing , link building , Pay	website
website/n/wlp_gb_g10/3726920	and to deter them from criminal activity . \" <p> 1428 : Proud teachers Pupils at Brecon High School have been doing their final checks and uploading stories onto the	website	. Miss Simmons e-mailed : " We have had a great day and I am very proud of what the pupils have achieved today - Well done ! " <p>	website
site/n/wlp_gb_g10/740442	different hands ' , different scripts , on different faces of , relate to different fields of ornament <p> Field <p> Field Name <p> Type <p> Length <p> 1 <p>	Site	<p> alphanumeric <p> 5 <p> 2 <p> Stone <p> numeric <p> - <p> 3 <p> Inscription <p> numeric <p> - <p> 4 <p> Doubtful <p> logical <p> - <p> 5	site
site/n/wlp_gb_g02/7205148	IELTS is in the @ @ @ @ @ @ @ @ @ @ things about the perfect verbs and \" get \" and unfortunately many others . However this	site	here is much usefull and it is interesting to learn from . I hope to be assimilate whit the new language at the time and of course not whitout hard	site
site/n/wlp_gb_g02/4283882	he most popular post in the history of Twitter within just 22 minutes , Kate Day , the Telegraph 's Social Media Editor , has flagged up some of the	site	's other election night statistics : <p> Twitter : Kate Day - RT @gov : After 100 million votes and 31.7 million Tweets , our recap of election day on	site
website/n/wlp_gb_g06/7347067	? Soon after Davies 's intervention , the Home Secretary Teresa May said that she @ @ @ @ @ @ @ @ @ @ no comment on PI 's	website	or Davies ' blog about this sinister and disturbing threat to privacy and openness at the time of writing , though there is a brand new post about a security	website
website/n/wlp_gb_g08/2602440	its friends are and act accordingly . I think the Argies are a bit too eager to claim support as I am sure that on one of the Argie paper	websites	Australia was included as one of the countries which ' wants the Malvinas to be returned to Argentina . ' <p> What I particularly liked was the sob story from	website
site/n/wlp_gb_g05/14475996	to do stuff for you without even saying anything to them about it , because you fear that there will be conflict . <p> So many posts lately on different	sites	have been about how the man is interested when the woman is not so interested early in the relationship . Then when the woman falls for the guy , often	site
site/n/wlp_gb_g11/23581987	animals that is too big or can not be homed . We deal in cruelty cases in horses or unwanted older pets , feral cats etc . At the Littleborough	site	we mainly have our animals sponsored to help the costs . <p> Fields in Trust wants to ensure that @ @ @ @ @ @ @ @ @ @ space	site
site/n/wlp_ca_b01/12967087	of the Washington , D.C.-based Solar Electric Power Association . \" With minimal inputs , including your state , county , utility , and typical monthly energy bill , the	site	provides you with estimates of ##3370324 <h> Link of the Day -- Bloglovin.com <p> This is a blog . A blog is an online diary . There are thousands of	site
site/n/wlp_ca_b01/13173038	deal . He @ @ @ @ @ @ @ @ @ @ a unique designation that applies to brownfields , \" planner Cam Thomas said of the former industrial	site	, adding the same planning designation applies to three other Dundas areas -- on Hatt Street , Creekside Drive and 10 Bond Street . <p> " There are special considerations	site
website/n/wlp_ca_b02/23118736	Juliana Davies taps into morality issues that have long been a mainstay of EthicScan Blog posts in the past . Juliana is a business writer whose work appears on a	website	devoted to proliferating the best online mba programs of 2012 and their standards in the educational space . <p> The Role of Top MBA Programs in Creating Ethical Entrepreneurs <p>	website
website/n/wlp_ca_b02/9854227	The other proposal , which was to give the Parliamentary @ @ @ @ @ @ @ @ @ ##3360450 <h> Post navigation <h> Why You Should Have Your Own	Website	<p> We live in an age where social media sites like Facebook and Twitter have become the go-to places on the web . Social networking sites are good at leveraging	website
website/n/wlp_ca_b01/23425226	business using the resources of Baltimore , Maryland-based Cangene bioPharma , Inc. ( a wholly owned subsidiary ; formerly Chesapeake Biological Laboratories , Inc. ; www.cangenebiopharma.com ) . Cangene 's	website	, http : //www.cangene.com/ , includes product and investor information , including past news releases . <p> " Cangene " is a trademark belonging to Cangene Corporation . <p> %SEDAR	website
site/n/wlp_ca_b02/24766067	n't wrong about . I also was n't wrong about how many copycats and more would come along ( more on that here : The Pending Implosion Of Daily Deal	Sites	) . I was wrong about their ability to scale and the power of the brand . It seems like Groupon " owned " the space . While LivingSocial is	site
website/n/wlp_ca_b01/18040069	traffic to your website is not the only thing that will ensure that your products or services will become popular or in high demand in a matter of days .	Website	content and design play equally important role in attracting and retaining customer base to ensure they keep coming back . Therefore , before investing heavily in SEO traffic management options	website
website/n/wlp_ca_b01/17207074	seem to indicate that it 's already happening -- http : **49;4337;TOOLONG -- keep practicing great , legitimate SEO and you 'll be back soon enough . <p> If your	website	is of poor quality ( compare your site with those at the top for a clear answer ) , then you need to come to terms with the new face	website
site/n/wlp_ca_b02/5279835	out there I can totally recommend CrossBrowserTesting . Not only it will grab screenshots of your pages @ @ @ @ @ @ @ @ @ @ version of the	site	you 're testing -- perfect for checking the behaviour of things like input boxes , drop-downs and sliders . <h> Dot Grid Journal <p> Every project I take on starts	site
website/n/wlp_ca_b02/14338448	now , most developer ( including myself ! ) used pixels to define font sizes . While pixels are ok when your website have a fixed width , a responsive	website	should have a responsive font . Indeed , a responsive font size should be related to its parent container width , so it can adapt to the screen of the	website
website/n/wlp_ca_b01/19768191	that you are looking for by contacting Statistics Canada with your question about the number of people with disabilities who are self-employed . You may make a request on their	website	or by calling toll-free at 1-800-263-1136 ( TTY 1-800-363-7629 ) . There are also some statistics available online ##3742503 <h> Group buying discount : Friend or foe to your business	website
website/n/wlp_ca_b02/24432848	<p> 2 . Using an FTP client ( uploading software ) . <p> Note : FTP stands for File Transfer Protocol . <h> Lots Of Files To Upload <p> Your	website	will contain a number of pages and probably some images ( including logo , background and more ) . Then you in the course of @ @ @ @ @	website
site/n/wlp_ca_b02/20523845	the county , and they tell the stories of the communities from the time they were founded to times that are more recent . <h> www.GenealogyCanada.com <p> Please visit our	site	- www.GenealogyCanada.com There is lots of Canadian genealogy news to browse through , so please drop in for a spell . There are also Canadian heritage and history news items	site
site/n/wlp_ca_b02/2912535	eight armed adult mobile and the giant monitor behind them , each song was highlighted with its own custom video feed , and eight arm arrangement . It was a	site	, I am sure , that everyone in attendance will remember for years to come . <p> The set list was a perfect balance of old and new , rare	site
site/n/wlp_ca_b02/4129351	<p> This is pretty funny . It read a lot like the \" Letter from an anime fan \" stories on something awful . I 'm looking forward to this	site	taking off . I hope you guys get recognized more and find more writers that ##3345089 <p> Please , have a seat , ladies and gents . Anywhere is dandy	site
site/n/wlp_ca_b01/20257186	provide assistance regarding any immigration issue . They frequently work with government agencies . <p> o Personal Injury Lawyers help get compensation for many different types of accidents . Construction	site	accidents , car accidents , and items like even elderly care abuse . <p> o Tax Lawyers help people do their tax returns and basically cope with all issues of	site
site/n/wlp_ca_b02/1187939	... \" In this life , one does not have to stand tall , but one does have to stand up \" ... which is what I do . <h>	Site	Meter <h> Thursday , November 8 , 2012 <p> Lindsay Goss is a reporter for the Pass Herald . Some people may remember her as the young woman who broke	site
website/n/wlp_ca_b01/16536595	the terms of the agreement , Becky Higgins will continue to oversee the design , development and marketing of all Project Life products , as well as independently operate her	website	, online store and blog . " <p> If you are still concerned , there are plenty of Photo Pocket Pages manufactured directly by Becky Higgins LLC still in our	website
website/n/wlp_ca_b01/17046263	through accessing the poker websites . These will greatly allow you to increase your takings while still handling your expenses . Some people choose to play on a range of	websites	; this is a specific thing we encourage because it will enable you to get multiple sign-up bonuses . Instead of driving right to offline casinos in your area or	website
website/n/wlp_ca_b01/11983234	, logistically very difficult , or you might need to take some steps to show the C-suite that the investment is worth it . If a full overhaul of your	website	is n't in the cards , a mobile friendly site can be built on a separate domain or a subdomain . Scripts can be placed that automatically redirect mobile devices	website
website/n/wlp_ca_b01/23604608	We have one person authorized to handle media inquiries . Our credibility and integrity are fundamental . <h> Disclaimer <p> Names , characters , places and incidents portrayed on this	website	are either products of the author 's imagination or have been used fictitiously . Any resemblance to actual events or ##3752835 <h> Flying in the Face of Change <h> Succeeding	website
site/n/wlp_ca_b01/18939796	the generosity and I can not tell you what a weight off my mind it is to know that many of the things I would like to update on the	site	will be able to happen over the next year as well . <p> For those who included messages of appreciation , I read them all and was touched . I	site
website/n/wlp_ca_b02/18053476	If you see this post anywhere else except on my site at thingsthatwedo.com @ @ @ @ @ @ @ @ @ @ part of this post ( or this	website	for that matter ) , to be re-produced , copied ##3382989 <p> You 'll hear it often enough : creativity will be the key to success . Thinking outside the	website
site/n/wlp_ca_b01/301708	de Lille , across from the Muse d'Orsay . They have wonderful traditional cuisine , like veal with lemon and mushrooms or the types of ##3335641 <h> Just another AgSpot.ca	Sites	site <h> The last pieces of the puzzle <p> by plastic injection mould on November 16 , 2012 <p> The assembly cycle of the Aircraft Carrier HMS Queen Elizabeth continues	site
site/n/wlp_ca_b02/11696312	<p> Thanks , Fidel ! <p> http : //twitter.com/Ayngelina Ayngelina <p> I prefer to do the hybrid trips . I come down for a press trip and see the main	sites	and then I stay a week longer and travel on my own . <h> Call me , maybe <h> Looking for Something ? <h> Who is Candice ? <p> Candice	site
