id	left	target	right	lemma
site/n/wlp_ca_g02/11125726	an application or game for Mobile . <p> Mobile Publisher <p> Publisher is a web site operator that helps to publish any content via an app , blog or a	site	. A publisher is able to display test link , ad , product link on any web site and so-on . <p> Mobile Website <p> Mobile Website is any site	site
website/n/wlp_ca_g01/20124110	have taken place online are helping homeowners to become more informed about dumpster sizing and usage . A new FAQ section has been added to the Dumpster Rental Quotes company	website	that answers many of the questions that go unanswered in normal hauler-customer negotiations . <p> Obtaining the correct size of dumpster to remove trash from a business or residential property	website
site/n/wlp_ca_g05/15779043	special website with photos , videos , games , and more . We 've bookmarked some Air Farce-related posts and exclusive videos you can only find on CBC 's 75th	site	, so CLICK HERE to take a look , including exclusive video-on-demand of Air Farce 's VERY FIRST TV SPECIAL from 1980 ! ... <h> BONUS VIDEO CLIPS <p> REMEMBERING	site
website/n/wlp_ca_g02/14798456	@ @ @ @ @ @ to the design phase . <p> Design phase . This is the phase when we come up with design concepts to determine how your	website	or application is going to look like . During this phase we only come up with a static concept . Static means that if you wanted your website or software	website
site/n/wlp_ca_g05/4637958	, that 's two weeks from today . You can send in as many suggestions as you like , but they should be fun , clever and relevant to the	site	. The winner will get a Galadan poster signed by both Martin Springett and GGK , and also a set of Martin 's Fionavar bookmarks . I 'll be the	site
site/n/wlp_ca_g02/7342028	content . YourHealthCheck does not recommend and does not endorse the content on any third party @ @ @ @ @ @ @ @ @ @ linked third-party sites ,	sites	framed within the YourHealthCheck Site , third-party sites provided as search results , or third-party advertisements , and does not make any representations regarding their content or accuracy . Your	site
website/n/wlp_ca_g03/11502209	feasting station and even my outside ants have moderated a bit . <p> So what is the secret ? Sweetness and borax . <p> There are several recipes on various	websites	for home-made ant killer . The one I am using is quick , easy and cheap to make . It consists of : <p> 2 cups sugar <p> 1 cup	website
site/n/wlp_ca_g05/8671516	impersonal and cold . IGS knew that people like to see someone like themselves when they get to a website . They chose to feature friendly professional people in their	site	design to provide a sense of connection . <p> The Team <p> Since IGS does almost all of its work by phone or email , they rarely meet their clients	site
site/n/wlp_ca_g02/9058907	gone over and have never seen them , it 's not a common sight . \" <p> The Hey Rosetta ! show will see over 2,500 people visit the concert	site	on Georges Island . The glacial drumlin---and its snakes---have n't seen this much activity in @ @ @ @ @ @ @ @ @ @ small shock to their system	site
website/n/wlp_ca_g01/16879252	and that 's when SEO-unfriendly site changes get implemented before your very eyes . Only by operationalizing SEO , by making it part of the way everyone who touches the	website	goes about their business , can we ensure success . In this model , @ @ @ @ @ @ @ @ @ @ a subject-matter expert and the curator	website
website/n/wlp_ca_g05/13709122	<p> For example , March 21 , 2012 will be ? Single Parents ? Day ? . A family law attorney could use the occasion to drive traffic to his	website	to view ? Ten Father ? s Rights You Should Know About ? . A restaurant could promote a special for single parents who bring their kids to dinner .	website
site/n/wlp_ca_g02/10071487	colleagues of then have grown to have experienced interesting lives , some with incredible achievements . <p> Your input and that of the others who have been communicating via your	site	would add great value to my writing . I am good friends with G. 's High Commissioner to Canada and know Sam Hinds ... plus many Guyanese authors , etc	site
website/n/wlp_ca_g02/20325826	accommodated for days after their original flights on 9/11 and 9/12. <h> 6 . Information during a strike <p> An airline may simply post their policies / news on their	website	as circumstances change . It is always a good idea during a strike to check the airline 's website. <h> 7 . What should you do to protect yourself during	website
site/n/wlp_ca_g03/2190643	buildings , the funiculars and the historic value of the old port . By 1998 , the steps to nominate the city in the list of UNESCO 's World Heritage	Sites	were completed . In 2003 , UNESCO inscribed the historic quarter of Valparaso as a World Heritage Site under the following criteria : <p> " Valparaso is an exceptional testimony	site
site/n/wlp_ca_g05/20200168	from the 1970s onward ) artists have turned away from the art institution toward more quotidian spaces such as the street , stores , homes , and schools as possible	sites	of engagement . She concludes that the " distinguishing characteristic of today 's site-oriented art is the way in which the artwork 's @ @ @ @ @ @ @	site
site/n/wlp_ca_g04/14273693	: 1 ) Demographic frequency tables and simple comparisons for all students in the sites ( e.g. , girls vs. boys ) ; 2 ) Descriptive report which puts the	site	results in perspective ; 3 ) Behavioural profiles of children with the highest and lowest scores for each scale ; these profiles are adjusted for actual frequencies of behaviours shown	site
site/n/wlp_ca_g05/15898272	@ @ Draft Copy Request ? <p> A sales draft copy request is sent to you from Moneris when a cardholder queries or disputes a purchase made on your web	site	. If you get one , please respond to it in the timeframe specified and provide the following : copy of the transaction record ( on-line receipt or email )	site
site/n/wlp_ca_g01/13272010	up on the CBC site in the next two days ? <p> Strategy number 15 : control the dynamics ... There is no way I can control anyone on this	site	... So you guys need to decide where is the next step ... Personnally , I like CBC but anything will do as long as we agree . <p> Strategy	site
site/n/wlp_ca_g01/32722	. This is especially true if you rely on key words ( such as \" sex \" ) for blocking . Certain key words appear on legitimate news and information	sites	, so it 's best to experiment with different settings when configuring the filter controls . <p> Installing filtering software is no guarantee that children wo n't be exposed to	site
site/n/wlp_ca_g01/15092328	the breadcrumb navigation at the top of a page . <h> What is the top link bar ? <p> The top link bar provides a way for users of your	site	to quickly navigate to other sites in the site collection by displaying a row of tabs at the top of every page in the site . <p> When you create	site
website/n/wlp_ca_g04/1796556	the bounce rate into new and returning visitors ? <p> Did they release another update to the way google ranks websites ? Ive noticed over the past few days some	websites	seem to bounce from ranks one to page two etc . This high rate of fluctuation makes me wonder what bases determine a websites 's rankings and whether changes in	website
site/n/wlp_ca_g03/12920458	authorized by this paragraph may violate copyright , trademark and other laws . The trademarks , service marks , trade names and logos ( \" Trademarks \" ) on this	site	are registered and unregistered trademarks of IFAW or others . You may not use any such Trademarks for any purpose without the prior written consent of IFAW . If you	site
website/n/wlp_ca_g05/6716975	( PBC ) and the RCMP have developed procedures to deal with both hard copy criminal record files and criminal record information on the CPIC system . <p> The RCMP	website	also provides the @ @ @ @ @ @ @ @ @ @ international agreements , the RCMP shares criminal records information with foreign authorities who may register this information	website
site/n/wlp_ca_g04/16204153	the mining industry he should include on his resume . Has he registered and posted his resume on our site ? We have over 40 000 jobs worldwide on our	site	, many of them in Australia . He can also apply for job alerts , so that when the recruiters on our site are looking for a specific person ,	site
site/n/wlp_ca_g04/10792373	of the court , they could ##432165 <h> Missing Ont. teen may not be in Canada : police <h> Last Updated : Friday , November 7 the content of external	sites	- links will open in new window ) <p> Police searching for an Ontario teenager whose disappearance may be connected to online video games say there is a possibility he	site
