id	left	target	right	lemma
singer/n/wlp_jm_g01/12874005	, Rastafarianism @ @ @ @ @ @ @ @ @ @ . Many of these felt pulled by ##1379244 <h> Where to Stay <h> Useful Information <h> Best Reggae	Singers	, Hands Down ! <p> Do n't all shout at once ! If your favourite reggae singers do n't make my list , maybe you need to be listening to	singer
singer/n/wlp_jm_g01/1042190	much to make good music . Power play of light , the spotlight is on another level in music . and I love having the opportunity to sing with great	singers	and see the energy release ... We share positive energy ! <p> How do you move up in your texts Jamaica ? <p> Jamaica will always be in my lyrics	singer
singer/n/wlp_jm_g02/14056751	a new album is scheduled for release in October . A message left with Evans ' agent Sunday was not immediately returned . ( Source : AP ) <p> Hip-hop	singer	Wyclef Jean said Sunday he is not abandoning his presidential bid just yet and will try to get the courts to @ @ @ @ @ @ @ @ @	singer
singer/n/wlp_jm_g01/9551523	runners in the 80 's and 90 's do not feel they have to mimic their male counterpart to succeed . They are defining themselves on their own terms .	Singer	Kris Kelli is one of the new breed of female artist . She entered the music business in 2003 . Her debut CD " My World " was released in	singer
singer/n/wlp_jm_g02/8773790	most famous for his Top 40 Singles \" Come into My Room \" and \" Diamonds \" . <h> Biography <h> Early life <p> Nathan is the son of reggae	singer	Lorna Gee . Nathan and his mother moved to Jamaica when he was two years old so that she could pursue her career . As her profile developed she relocated	singer
singer/n/wlp_jm_g01/12079474	and deception is a common experience for a lot of people , nuff people no real , dem only ah pretend until you see their true colours , \" the	singer	who was born Nicholas Levy , said . <h> September 17 , 2010 <h> Future Fambo on a musical high with Rum and Red Bull <p> If you happen to	singer
vocalist/n/wlp_jm_g01/8073255	a mp3 called Sunshine available for download.I cant say I was prepared for what I heard.Not did I hear a glorious song but what captivated me totally was the female	vocalist	on the track . Her voice was exactly the English voice I had heard in my head while working on the lyrics with Jessie . <p> I was completely stunned	vocalist
singer/n/wlp_jm_g02/7781212	, is one of those rare women who control their artistic destiny . As a result , she has achieved an impressive chain of accomplishments She became the first female	singer	nominated for a GRAMMY in the category of reggae music when her ' WORKING WONDERS ' LP was nominated in 1985 . <p> She was the first female reggae artist	singer
singer/n/wlp_jm_g01/7421852	human desire for reciprocated love . <p> But everyone , from the airwaves to the clubs , was falling in love with the duo . <p> As Devonte , the	singer	of the duo , put it , " it hit the mark in Jamaica in 1997 then hit the international scene in 1998 then went into 1999 as a major	singer
singer/n/wlp_jm_g01/5979456	an audit of his community service was ordered in July . <p> Brown was also ordered to ##1362645 <h> Rising Zimbabwean Reggae Singer Jah Prayzah Heads for UK Tour <p>	Singer	Jah Prayzah , real name Mukudzei Mukombe , and his band will this Wednesday leave for the United Kingdom where they are expected to stage three shows in different cities	singer
singer/n/wlp_jm_g01/12012105	a big impression on Dancehall circles this summer as she 's set to release a slew of projects that will turn heads locally and internationally . <p> The Hold Him	singer	recently returned to the spotlight with her sultry collaborations with prominent Dancehall star , Assassin entitled Phone Seduction as well as Falling In Love With You alongside the much vaunted	singer
singer/n/wlp_jm_g02/2409790	n't really need to come out so much , it 's more of a oneness for me . <p> Francesca : Do you feel if any of the female backup	singers	decided to come forward they would be embraced ? <p> Una : I think so because reggae music needs to see some fresh new faces . You know , every	singer
vocalist/n/wlp_jm_g01/16454175	Which would be a shame . So if JGL as Batman is the domino that starts this catastrophic fall , you can ##1826141 <h> 2007 Festival Performers <p> A lifelong	vocalist	, Effie Burt was born and raised in Oxford , Mississippi as one of twelve musically gifted siblings . Effie has been performing since the age of 13 with her	vocalist
singer/n/wlp_jm_g02/971815	a brief speech . <p> While Diddy and Jadakiss were added to the program as last minute headliners , they were nowhere to be found , leaving highly underrated dancehall	singer	Mr. Vegas @ @ @ @ @ @ @ @ @ @ minutes before the required midnight cutoff . While that did n't leave Vegas with much time to acquit	singer
singer/n/wlp_jm_g01/14470251	Buy any purchases on way back . Some airport prices are less expensiveUpon arriving at the Sangster airport in Montego Bay and had to find baggage . There were Jamaican	singers	to greet you at Immigration . Then I found the Sandals/Beaches shuttle bus to travel to Negril . Porters will grab your luggage ( and expect a tip ) so	singer
singer/n/wlp_jm_g01/3157901	assault charges after an altercation with then girlfriend Rihanna . <p> In America , according to www.abcnewsgo.com the Parents Television Council is condemning the video , saying it depicts the	singer	in an " implied rape scene with a man whom she later guns down in an act of premeditated murder . " <p> premeditated murder <p> Melissa Henson of @	singer
singer/n/wlp_jm_g02/12277723	to be two week 's time . New York will therefore experience the second coming of Junior Kelly on July 22 at the Village . <p> However , as the	singer	emphasised , " It 's not about Junior Kelly , it ##1378382 <h> Mighty Crown 's Month-Long European Tour A Hit <p> Mighty Crown " The Far East Rulaz "	singer
singer/n/wlp_jm_g01/9904332	@ @ @ @ @ @ @ @ the city 's east end , yearning for that big break which came with Call The Hearse . <p> I-Wayne : Another	singer	who did the studio rounds ( in his native Portmore and Kingston ) before scoring with two chart hits in 2004 . Familiarity with the tedium and rejection that go	singer
singer/n/wlp_jm_g02/12161112	he has been working with several top producers such as Donavan Germaine , Kemar \" Flava \" McGregor , and Donovan Bennett , just to name a few . The	singer	's latest hit , Been There , has been blowing up all over FM radio here in Jamaica and in New York over the last six weeks , a great	singer
singer/n/wlp_jm_g02/10617001	remarkable heritage . Recorded in the Bensalem , Pennsylvania location of his Love Fellowship Tabernacle and produced by fellow Grammy winner Donald Lawrence ( The Clark Sisters , the Tri-City	Singers	) , SOULED OUT is the next logical step in Walker 's career , adding a fresh batch of songs to a repertoire that 's already one of the most	singer
singer/n/wlp_jm_g02/6145772	world 's musicians would be making their way to Jamaica to holiday and record . <p> Therefore it was no real surprise when word began to spread that controversial British	singer	Amy Winehouse was on the rock to getaway and focus on recording material for the follow-up to he successful release , the Grammy Award-winning Back to Black album , which	singer
singer/n/wlp_jm_g02/10130200	child , it means that you are able to migrate with them or undertake various transactions on their behalf , since you would be listed as a parent . <p>	Singer	Seal and model Heidi Klum watch the Los Angeles Lakers play the New Orleans Hornets in their NBA basketball game with their kids . Seal , who met Klum when	singer
singer/n/wlp_jm_g01/9557424	3 teenage boys , Casper , Preston and Mark , start their journey to becoming men and along the way meet Choppy and Eve . <p> A theatre actor ,	singer	, dub poet , dancer and DJ seem like an unlikely team to head a film cast but the union created a hilarious Jamaican coming of age story . 24-year-old	singer
singer/n/wlp_jm_g02/3644996	for many a years ! We all listen to and appreciate all different genres of music . We produce everything from hip hop , electronic music to acoustic , folk	singers	. However , we 've all made an emotional connection at some @ @ @ @ @ @ @ @ @ @ grabs you , like no other genre in	singer
singer/n/wlp_jm_g02/6704810	In 2008 they released the two-CD set The Lost Tapes , with songs recorded at concerts between 1966 and 1967 in San Francisco , and featuring Janis Joplin as lead	singer	. Some songs had already been unofficial releases , but there are 12 never-before-released songs . <p> Former guitarist James Gurley died on December 20 , 2009 of a heart	singer
